title,description,cost,license,app_type,origin,platform,supported_languages
Outlast,Outlast is a series of first-person survival horror video games developed by Red Barrels. The plot centers around each game's protagonist trying to survive from a pursuing enemy whilst exploring poorly-lit environments with their camcorder and attempting to uncover the...,Pay once,Proprietary,Horror Game,Canada,"Mac, Windows, Linux, Epic Games Store, Steam, Playstation, Nintendo Switch, Xbox",English
Traze.com,"Traze, a prominent CFD and Forex trading platform, is upending the trading landscape with its dedication to accessibility, fairness, and openness. Traze, with a team of skilled traders and analysts, is changing the way traders approach the market.",Pay once,Proprietary,Trading Platform,N/A,Online,"English, Portuguese, Spanish"
Hutte,Hutte is a user-friendly Salesforce DevOps tool that optimizes Git-based development with an intuitive UI and time-saving features.,Subscription,Proprietary,N/A,N/A,Software as a Service (SaaS),English
Meld Studio,"Meld Studio is a robust live streaming tool that enables building creative, broadcast-quality live streams with consumer hardware.",Free,Proprietary,"Live Streaming Tools and Service, Screen Recorder",United States,Mac,English
Narrative BI,"Narrative BI is an all-in-one marketing analytics and reporting platform for growth, marketing, sales, and product teams in every company, including agencies. It automatically generates insights from marketing channels and turns them into reports (narratives).",Freemium (Subscription),Proprietary,N/A,N/A,"Online, Software as a Service (SaaS)",English
SIUX Studio,Our framework enables multidisciplinary teams to maintain agility and excellence in building digital products.,Free Personal,Open Source,N/A,N/A,Online,English
Our Paint,Our Paint is a featureless but programmable painting program.,Free,Open Source ( GPL-3.0 ),Digital Painting Tool,China,"Windows, Linux, Android  , itch.io","English, Chinese"
CheckYa,"Help freelancers and online business owners to send invoices, receive payments, sell digital downloads, and offer bookings.",Free,Proprietary,Online Store Builder,United States,Online,English
Cara,Cara is a social media and portfolio platform for artists in the entertainment industry.,Free,Proprietary,"Art / Design Community, Social Network",N/A,"Online, Android, iPhone",English
Our Paint,Our Paint is a featureless but programmable painting program.,Free,Open Source ( GPL-3.0 ),Digital Painting Tool,China,"Windows, Linux, Android  , itch.io","English, Chinese"
Windmill Labs,"Turn scripts into sharable apps and APIs, compose them as workflows or data pipelines and expose them with UIs on the fastest and most reliable job orchestrator. Self-hostable worker infrastructure: horizontally scalable, reliable, ultra-fast.",Freemium (Subscription),Open Source,N/A,N/A,"Self-Hosted, Software as a Service (SaaS)",English
Superflows,"Superflows is your AI email assistant helping you get through your inbox faster. Get AI generated summaries of incoming emails, pre-generated 1-click replies that sound like you, and compose emails from prompts with customisable tone of voice.",Freemium (Subscription),Open Source ( Apache-2.0 ),AI Writing Tool,United Kingdom,"Online, Self-Hosted",English
Flywheel - Analytics,Flywheel helps B2B SaaS companies convert free users to paying customers. Discover which marketing campaigns and tactics drive product adoption in minutes.,Freemium (Subscription),Proprietary,N/A,United States,Online,English
Nocode:nohack,"nocode:nohack is a SaaS to check if you have sensitive data (token, secret, email, users data) not protected on your Bubble app by checking your privacy rules, api Endpoint, Content of your pages and other things. Mobileapp discovery",Subscription,Proprietary,N/A,"France, EU",Online,English
NcScale,The all-in-one no-code Software Development LifeCycle management tool. All mandatory services no-coders have been waiting for. Start making maintainable no-code.,Free,Proprietary,N/A,"France, EU",Online,English
Stirling PDF,"Locally hosted web application offering an interactive GUI to merge, split, reorganize, convert, compress, watermark, secure, sign, flatten, repair, extract images, detect blanks, apply OCR, set permissions, and enable file processing or API integration for PDFs.",Freemium,Open Source,"PDF Editor, PDF Reader",United States,"Mac, Windows, Online, Self-Hosted, Cloudron, Docker Hub","English, Arabic, Azerbaijani, Basque, Bulgarian, Catalan; Valencian, Croatian, Czech, Danish, Dutch, French, German, Greek, Hindi, Hungarian, Indonesian, Irish, Italian, Japanese, Korean, Norwegian, Persian, Polish, Portuguese, Romanian, Russian, Serbian, Chinese, Slovak, Spanish, Swedish, Thai, Tibetan Standard, Tibetan, Central, Turkish, Ukrainian, Vietnamese, ▾"
Serializd,"Track, rate, and review your favorite TV shows. Join the conversation. With a lively community of users, Serializd is the best place to discuss the latest ""Succession"" episode or find friends to talk about your ""Friends"" rewatch with.",Free,Proprietary,"Episode Tracker, Movie Review Site",N/A,"Windows, Android, iPhone",English
Metos,Characters and Worlds we will never forget.,Freemium (Subscription),Proprietary,"Novel Authoring Tool, World Building Game",United Kingdom,Online,English
Leonardo.Ai,"Generative AI production platform for creating diverse, unique assets with pre-trained or personalized AI models. Not limited to visuals, it offers art asset flexibility, supports rapid iteration, and maintains a consistent style for innovation in game asset creation.",Freemium,Proprietary,AI Image Generator,Australia,"Online, Android, iPhone, Android Tablet, iPad",English
WeatherMind: Health & Forecast,"WeatherMind helps you understand the impact of weather on your health. With personalized weather forecasts, self-assessments, and journaling, our app helps you take control of your well-being.",Freemium (Pay once),Proprietary,Weather Forecast Tool,N/A,"Android, iPhone",English
Herdi.ng,Herdi.ng is a no-frills visual bookmarking tool that lets you organize (or herd) your findings into YOUR own structure.,Free,Proprietary,Bookmark Manager,N/A,Online,English
Billdr PRO,"Billdr PRO is an all-in-one construction management software for general contractors. The product is tailor-made for small to medium crews and fits the best home renovation sector. Contractors can send quotes, and invoices, change orders, do their profit and lost, and manage...",Freemium (Subscription),Proprietary,N/A,Canada,"Windows, Android, iPhone, Android Tablet, iPad","English, French"
Nacsport,Nacsport Video Analysis Software has been designed for analysing sports through video. It is available for Windows and MacOS and was developed by the Spanish company Nacsport.,Paid,Proprietary,N/A,N/A,Windows,"English, French"
Slik Protect,Slik Protect offers comprehensive visibility into the security posture of your cloud infrastructure and databases with its backups and agentless scanning technology.,Subscription,Proprietary,Online Backup Tool,United States,Online,English
SMBAct,SMBAct is the all-in-one cross-platform solution that allows you to keep your windows and applications well-organized and significantly simplify the process of interaction with them.,Pay once,Proprietary,Window Manager,United States,"Mac, Windows, Linux",English
Omnibus,"Omnibus is an AI-powered omni-channel sales platform that enables businesses to drive their sales through multiple channels like eCommerce website, Point of Sale for brick and mortar stores, mobile app and Amazon using a unified admin console.",Free,Proprietary,E-commerce System,N/A,Online,English
Ollie - AI Photo Organizer,"Ollie is a smart assistant that organizes your camera roll, categorizes your photos, and ensures privacy by storing data on your device.",Freemium,Proprietary,"Duplicate Images Finder, Photo Manager",United States,iPhone,"English, Portuguese"
Rent.,"With Rent. you'll find the fastest way to search houses, apartments, condos and townhouses for rent anywhere in the US. With 1,000s of new listings every day we can help you find the perfect rental home, whether it's in Miami, New York, Atlanta, Chicago, Dallas, Phoenix...",Free,Proprietary,N/A,United States,"Online, Android, iPhone, Android Tablet, iPad","English, Spanish"
Reviewly,"Create take-home projects to send to your job candidates, where you can ask them to code, discuss an issue, and/or review a PR directly in a private repository on GitHub.",Paid,Proprietary,N/A,N/A,Online,English
Saturation,"Saturation streamlines production management for filmmakers, producers, and creative production companies. Enjoy real-time collaboration, budgeting, expense tracking, and seamless integrations with modern workflows. Get started with our always-free version.",Free,Proprietary,N/A,N/A,"Online, Software as a Service (SaaS)",English
Actioner,"Actioner unifies customer feedback, product usage data, and CRM insights to help sales leaders and success teams retain customers, prevent churn, and uncover upsell opportunities.",Free,Proprietary,N/A,N/A,Online,English
HelpDesk,"Streamlines customer communication with an AI-powered ticketing system and automation, providing tools for collaboration, integration, data safety, and analysis. Offers customizable email templates, canned responses, and 24/7 support to ensure efficient operations and customer satisfaction improvements.",Subscription,Proprietary,"Help Desk Platform, Customer Feedback Manager",United States,"Online, UNIX Web Browser, LiveChat, Software as a Service (SaaS)",English
Earnweb,"Earnweb.com is a platform where you can earn money by completing various tasks such as surveys, games, cashback, and more. The site offers fast and convenient withdrawal options such as PayPal, cryptocurrencies, gift cards and much more.",Free,Proprietary,Reward Program,N/A,"Online, Android, Android Tablet","English, Polish"
Google Duet AI,"Duet AI is your thought partner, source of inspiration, and productivity booster in Google Workspace. Complete this form to request a trial and try it today at no cost.",Subscription,Proprietary,N/A,United States,"Online, Google Cloud Platform  ",English
Pi - Personal AI,"Pi is a new kind of AI, one that isn’t just smart but also has good EQ. We think of Pi as a digital companion on hand whenever you want to learn something new, when you need a sounding board to talk through a tricky moment in your day, or just pass the time with a curious and...",Free,Proprietary,"AI Chatbot, Large Language Model (LLM) Tool",United States,"Online, iPhone, iPad, WhatsApp Messenger, Instagram, Facebook Messenger",English
The Criterion Channel,"Classics and discoveries from around the world, thematically programmed with special features, on a streaming service brought to you by the Criterion Collection.",Subscription,Proprietary,"Video Streaming App, Movie Streaming Service",United States,"Online, Android, iPhone, Android Tablet, iPad, Apple TV, Android TV, Fire TV, Roku, Xbox",English
The Roku Channel,"Stream thousands of movies and TV shows for free from a vast library, including 350+ live channels, without a subscription or credit card. New titles are added weekly. Enjoy family-friendly programs, popular movies, classic series, and kids’ entertainment on multiple devices.",Freemium,Proprietary,"Video Streaming App, Movie Streaming Service",United States,"Online, Android, iPhone  , Android Tablet  , iPad  , Fire TV, Roku",English
Kaiber SuperStudio,"Harness advanced AI to transform images and text into videos. Explore unique features like Spotify Canvas for musicians, inspiring artists, and empowering creators, all without the need for any payments. Perfect for those keen to push the boundaries of creative AI.",Freemium (Subscription),Proprietary,AI Video Generator,United States,"Online, Android, iPhone, Software as a Service (SaaS)",English
Paramount+,"Welcome to A Mountain of Entertainment. Stream tens of thousands of full episodes—including favorites from CBS, Nickelodeon, Nick Jr., Comedy Central, BET, MTV and Smithsonian Channel—plus exclusive shows, brand-new originals, and live sporting events like UEFA Champions League...",Subscription,Proprietary,Movie Streaming Service,United States,"Online, Android, iPhone, Android Tablet, iPad, Apple TV, Android TV",English
Podium.page,"Podium is the ultimate podcast editing service that uses AI-generated show notes, summaries, chapters, transcripts, and highlights to supercharge your post-production workflow. With Podium's AI copywriting software, you can generate high-quality show notes and summaries in...",Freemium (Subscription),Proprietary,Audio Transcription Tool,United States,Online,English
GoodbyeDPI,This software designed to bypass Deep Packet Inspection systems found in many Internet Service Providers which block access to certain websites.,Free,Open Source ( Apache-2.0 ),Privacy Tool,Russia,Windows  ,English
GPT4ALL,"Locally runs open-source chatbots focused on privacy using consumer CPUs, requiring no internet or GPU. Supports multiple models, custom settings, code and dialogue generation, integrated model downloader, familiar chat UI, and both MIT and enterprise licensing.",Subscription,Open Source ( MIT ),"AI Chatbot, Large Language Model (LLM) Tool",United States,"Mac, Windows, Linux, Flathub",English
Google Gemini,"AI assistant offers writing, planning, learning support, generating images from text, and transforming text to speech. Utilizes large language models and syncs across devices without requiring coding skills. Supports dark mode and ad-free experience.",Freemium (Subscription),Proprietary,"AI Chatbot, Large Language Model (LLM) Tool",United States,"Online, Android, iPhone, Android Wear, Google Docs, Gmail","English, Arabic, Catalan; Valencian, Croatian, Czech, Danish, Dutch, Finnish, French, German, Greek, Hebrew, Hindi, Hungarian, Indonesian, Italian, Japanese, Korean, Malay, Norwegian Bokmål, Polish, Portuguese, Romanian, Russian, Chinese, Slovak, Spanish, Swedish, Thai, Turkish, Ukrainian, Vietnamese, ▾"
LetMeKnow,"LetMeKnow is a versatile news aggregator designed to cater to users worldwide. More than just a news reader; is your go-to app for curated news, interactive features, and a personalized experience.",Free,Proprietary,"News Reader, RSS Reader",United States,"iPhone, iPad, Android",English
Ulaa,"A browser that respects your privacy, protects your personal data, and is designed to upgrade the way you work online but it's chromium based browser.",Free,Proprietary,Web Browser,India,"Mac, Windows, Linux, Android, iPhone, Android Tablet, iPad, Flathub, Flatpak","English, Arabic, Bulgarian, Catalan; Valencian, Croatian, Czech, Danish, Dutch, Finnish, French, German, Greek, Hebrew, Hindi, Hungarian, Indonesian, Italian, Japanese, Korean, Lithuanian, Malay, Norwegian Bokmål, Persian, Polish, Portuguese, Romanian, Russian, Serbian, Chinese, Slovak, Spanish, Swedish, Thai, Turkish, Ukrainian, Vietnamese, ▾"
Stackstream,"Connect with developers across the world. Solve a bug, organize a Hackathon, build a Community, or just chat with your colleagues. It’s a live streaming platform - where developers never have to code alone🚀",Free,Proprietary,Online Education Service,N/A,Online,English
HeyGen,"Transforms text into professional, browser-based HD videos using AI, offering 300+ voices in 40+ languages, scene merging, customizable visuals and music, quick production, unlimited downloads, and easy collaboration for marketing, training, or onboarding purposes.",Freemium (Subscription),Proprietary,"AI Video Generator, Text to Speech Service",United States,"Online, iPhone, iPad","English, Portuguese"
Breveto,"Breveto is a beautiful writing app for Mac with an elegant writing experience. You can use it for note-taking, writing, journaling, task lists, project planning, dev notes; you name it!",Freemium (Subscription),Proprietary,Note-taking Tool,United States,Mac,English
Amazon CodeWhisperer,"Amazon CodeWhisperer is a general purpose, machine learning-powered code generator that provides you with code recommendations in real time. As you write code, CodeWhisperer automatically generates suggestions based on your existing code and comments.",Freemium (Subscription),Proprietary,AI Coding Assistant,United States,"IntelliJ IDEA, Visual Studio Code, Linux, Mac, Windows",English
There's An AI For That,"There’s An AI For That (TAAFT) is a large AI tools site that helps users discover the right AI for specific tasks, jobs, and workflows.",Free,Proprietary,App Discovery Service,N/A,Online,English
Roughly,Roughly is an AI-powered Sketch-to-Image tool that allows users to convert their ideas into visuals. It caters to all skill levels with its easy-to-use interface and a variety of features for creating designs.,Free,Proprietary,"AI Image Generator, AI Image Editor",N/A,Online,English
Adspire,"Adspire is an AI-based software that generates multiple ad creatives. It uses three methods: Product Ads, Creative Ads, and Ad Builder. Product Ads require a product photo, theme, and ad size for AI to generate ads.",Paid,Proprietary,N/A,United States,"iPhone, iPad, Online",English
Meshy,"Turn 2D images or text prompts into 3D models quickly using AI-driven modeling and texturing, automate asset generation, speed up creative workflows, and create usable 3D files for games or digital art projects, removing manual sculpting or scanning.",Freemium (Subscription),Proprietary,3D Modeler,United States,Online,English
AME Wizard,"AME Wizard is an opensource tool for modifying Windows.




Build your own configuration for AME Wizard with Playbooks, a modular extension format containing simple YAML instructions to be applied. Verifying your Playbook allows you to build a trusted userbase. You can also browse t.",Free,Open Source ( MIT ),N/A,N/A,Windows,English
Apple Health,"The Apple Health app provides a central and secure place for your health and fitness information, so it’s easily accessible and under your control.",Free,Proprietary,"Run Tracker, Health Tool",United States,"iPhone, iPad, Apple Watch","English, Arabic, Catalan; Valencian, Chinese, Croatian, Czech, Danish, Dutch, Finnish, French, German, Greek, Hebrew, Hindi, Hungarian, Indonesian, Italian, Japanese, Korean, Malay, Norwegian Bokmål, Polish, Portuguese, Romanian, Russian, Slovak, Spanish, Swedish, Thai, Turkish, Ukrainian, Vietnamese, ▾"
MetaVoice Studio,"This tool allows users to record their voice or upload a file to create a custom voice clip. It offers a free plan with 6 voices, 30 second clip length, and a non-commercial license. Paid plans include 8 voices, 10 minute clip length, a commercial license, and custom voices...",Freemium (Subscription),Proprietary,"Voice Changer, Soundboard",N/A,Online,English
HuggingChat,"A groundbreaking open-source alternative to ChatGPT, offering code writing, email drafting, and more tasks in a privacy-friendly, ad-free environment without requiring sign-up.",Freemium (Subscription),Open Source,"AI Chatbot, Large Language Model (LLM) Tool",United States,"Mac, Online, iPhone, iPad","English, French, German, Italian, Spanish"
Jammable,"Produce AI-generated music covers with customizable tracks using trending artist voice models such as Juice WRLD, Drake, Kanye West, and Travis Scott. Enjoy free initial track creation, a user-friendly platform, sharing options, and covers popular on TikTok and YouTube.",Subscription,Proprietary,"AI Music Generator, Music Production App",United Kingdom,Online,English
Musicfy.lol,"Web-based tool lets users generate and share AI covers of popular tracks, customize song attributes such as duration, BPM, and frequency, explore a library of trending and user-made songs, and listen to high-quality, human-like vocal renditions instantly.",Subscription,Proprietary,Music Production App,United States,Online,English
Run:ai,"Transform your AI infrastructure with Run:ai to accelerate development, optimize resources, and lead the race in AI innovation.",Subscription,Proprietary,N/A,Israel,"Online, Software as a Service (SaaS)",English
StableLM,"StableLM is an open-source language model developed by Stability AI that can generate text and code for various downstream applications. StableLM showcases the power of small, efficient models that can generate high-performing text and code locally on personal devices.",Free,Open Source ( Apache-2.0 ),"AI Chatbot, Large Language Model (LLM) Tool",United Kingdom,"Online, Self-Hosted",English
yetCalc,Yet another calculator designed and developed for Android. AndroidOS,Free,Open Source ( BSD-3-Clause ),Calculator,N/A,"Android, F-Droid",English
Screen Story,"Screen Story is a video creation tool for MacOS that doesn't require advanced editing skills. It includes features such as Smooth Cursor for quality animation, AutoZoom and AutoFollow for automatic zoom animations, and Motion Blur for smoother videos.",Freemium (Subscription),Proprietary,"Screenshot Capture Tool, Video Editor",Australia,Mac,English
InterSub,"InterSub helps elevate one's English and Spanish-speaking skills while watching YouTube, Netflix, and Coursera – free of charge. Watch, translate, memorize and have fun!",Freemium (Subscription),Proprietary,Translator,N/A,Google Chrome,"English, Spanish, German, Portuguese, Turkish, Kazakh, French, Arabic, Chinese, Czech, Danish, Dutch, Greek, Hindi, Hungarian, Indonesian, Italian, Latvian, Lithuanian, Malay, Polish, Slovak, Swedish, Tatar, Turkmen, Ukrainian, Urdu, ▾"
Copysmith,"It's never been simpler to create better content. Create, edit, and optimize all your content in record time!",Paid,Proprietary,AI Writing Tool,United States,"Online, Google Chrome",English
Brancher.ai,"Brancher.ai is a platform that enables users to connect and use Al models to create powerful apps without the need for coding knowledge. With Brancher.ai, users can create Al-powered apps quickly and easily, allowing them to tap into the potential of Al and build unique...",Freemium,Proprietary,N/A,United States,Online,English
Adobe Firefly,"Experiment, imagine, and make an infinite range of creations with Firefly, a family of creative generative AI models coming to Adobe products.",Subscription,Proprietary,"AI Image Generator, AI Video Generator",United States,"Online, Adobe Illustrator, Adobe After Effects, Adobe Photoshop, Adobe Lightroom, Adobe Creative Cloud, Adobe Premiere Pro, iPhone, Android","English, French, German, Japanese"
Hume AI,"APIs enable multi-modal analysis of emotional expression in text, voice, visuals, and images, detecting subtle cues like sarcasm, empathy, and relief for developers building well-being-aligned, human-centered products, supporting research, analytics, and adaptive feedback.",Subscription,Proprietary,N/A,United States,Online,English
PaperRoll,"PaperRoll is a Mac app that gives you all the superpowers of great note-takers, without any of the work of keeping great notes.",Freemium,Open Source,"Note-taking Tool, Todo List Manager",N/A,Mac,English
Praktika.ai,Praktika.ai is an English learning platform that uses AI Avatars with different backgrounds and accents to provide comprehensive courses and interactive content for language learning.,Freemium,Proprietary,Language Learning Tool,N/A,"iPhone, Android",English
Pestle,"Pestle is an app that allows you to save and import recipes from anywhere online, keeping only the ingredients and steps. It offers guided cooking which turns any recipe into a step-by-step process that can be controlled hands-free.",Freemium (Subscription),Proprietary,"Recipe Manager, Grocery List App",Australia,"iPhone, iPad",English
Proton Pass,"End-to-end encrypted password management and identity protection. Developed by CERN scientists as part of Proton’s services, ensuring peace of mind for millions with open-source, battle-tested encryption. Supports two-factor authentication, synced across devices.",Freemium (Subscription),Open Source ( GPL-3.0 ),"Password Manager, Authenticator",Switzerland,"Mac, Windows, Linux, Online, Android, iPhone, Android Tablet, iPad, Snapcraft, Google Chrome, Flathub, Safari, F-Droid, Mozilla Firefox","English, Belarusian, Czech, Finnish, French, Georgian, German, Greek, Italian, Japanese, Korean, Norwegian Bokmål, Polish, Portuguese, Romanian, Slovak, Spanish, Swedish, Turkish, Ukrainian, Vietnamese, ▾"
LanceDB,"LanceDB is an open-source database for vector-search built with persistent storage, which greatly simplifies retrieval, filtering and management of embeddings.",Free,Open Source ( Apache-2.0 ),N/A,United States,Self-Hosted,English
Luma AI,"Capture in lifelike 3D - An AI-powered tool to capture any 3D object and reproduce it with unmatched photorealism, reflection, and details.",Free,Proprietary,"3D Scanner, 3D Modeler",United States,"Online, iPhone  , iPad","English, Indonesian, Hindi, Portuguese, Spanish, Thai, Turkish"
AerynOS,"Experience a revolutionary Linux distribution that puts you in control. With atomic updates, blazing-fast performance, and industry-leading reliability, AerynOS represents the next evolution in operating systems.",Free,Open Source,"Linux Distro, Operating System",United States,Linux,English
Framebird,"Framebird is a media sharing platform that combines modern gallery designs with a clear, contextual feedback system for creatives.",Freemium (Subscription),Proprietary,N/A,N/A,Online,"English, German"
Geekflare,"Geekflare is an online publication that produces high-quality articles on Technology, Business, and Fintech. Geekflare articles are read and loved by more than 4 million people worldwide.",Free,Proprietary,Tech News Site,United Kingdom,Online,English
LibreX,"LibreX gives you results from Google, Qwant, Ahmia and popular torrent sites without spying on you.",Free,Open Source ( AGPL-3.0 ),"Web Search Engine, Image Search Engine",International,"Online, Self-Hosted",English
