title,description,cost,license,app_type,origin,platform,supported_languages
Inciteful,Build a network of academic papers and we'll analyze the network to help you discover the most relevant literature.,Free,Proprietary,N/A,N/A,Online,English
Litmaps,Discover the world of Scientific Literature - LITERATURE REVIEW SOFTWARE FOR FASTER RESEARCH AND DISCOVERY,Freemium (Subscription),Proprietary,N/A,United Kingdom,Online,English
Awakish,"Who's minding your online store? Awakish is! When there's trouble your team is notified instantly, so your store is always open. Set up in minutes, just $7/mo.",Freemium (Pay once),Proprietary,N/A,N/A,Online,English
Loopin,"Loopin is a powerful collaboration platform that transforms your meetings into workspaces, allowing your team to work together seamlessly and access all relevant information in one place. With Loopin, you can easily connect similar meetings and view past meeting recaps for a...",Freemium (Subscription),Proprietary,"Note-taking Tool, Team Collaboration Tool",United States,"Online, Software as a Service (SaaS)",English
Becafex,"Becafex is the ultimate all-in-one software that helps you save time and maximize productivity. Keep track of tasks, collaborate with your team, create documents, set goals, and chat with customers - all in one place!. Newsoftware releases",Subscription,Proprietary,"Task Management Tool, Document Manager",N/A,Online  ,English
Knowt,"Knowt is the best all-in-one tool to create and study flashcards or notes! Centralizes the note writing and study experience into one app by transforming any note into intelligent study tools, like flashcards and questions, using AI. Mobileapp discovery",Free Personal,Proprietary,Flashcard Learning Tool,United States,Online,English
MacWhisper,"Quickly and easily transcribe audio files into text with OpenAI's state-of-the-art transcription technology Whisper. Whether you're recording a meeting, lecture, or other important audio, MacWhisper quickly and accurately transcribes your audio files into text.",Freemium (Pay once),Proprietary,Audio Transcription Tool,"Netherlands, EU",Mac,"English, Spanish"
NebiOS,"NebiOS is Ubuntu-based distro that successor of the discontinued Spez Linux project (the developers behind Spez Linux is now defunct). NebiOS is built on secure, privacy-respectful, universal foundation and ideal for being daily driver OS, enterprise, gaming with Windows-class... OperatingSystems",Free,Open Source ( Apache-2.0 ),Linux Distro,Türkiye,Linux,"English, Turkish"
Infisical,"Infisical is an open source, end-to-end encrypted secret manager which you can use to centralize your API keys and configs. From Infisical, you can then distribute these secrets across your whole development lifecycle - from development to production .",Freemium (Subscription),Open Source ( MIT ),N/A,United States,"Linux, Kubernetes, Docker","English, Spanish, German, Korean, Turkish, Portuguese, Indonesian, Japanese"
Deepdub,"Deepdub is an AI-powered platform offering dubbing and voice-over services. It includes features like text to speech, speech to speech, voice cloning, and accent control. The platform offers Deepdub GO, a virtual AI studio for post-production, and Enhanced eTTS™ Technology for...",Paid,Proprietary,Text to Speech Service,United States,Online,English
Gola: Goal-Tracker,"Gola is a powerful and customisable goal-setting app for iOS & watchOS to help you stay on track and easily achieve your goals. It offers 6 different goal types, AI-powered advice, customisable themes and icons, widgets, and more. MobileApps & Add-Ons",Freemium (Subscription),Proprietary,N/A,"Netherlands, EU","iPhone, iPad, Apple Watch","English, Catalan; Valencian, Chinese, Czech, Danish, Dutch, French, German, Italian, Japanese, Polish, Portuguese, Russian, Spanish, Swedish"
Ingestro,Ingestro provides AI-powered data integration solutions designed to help software companies turn unpredictable data into actionable momentum—faster and more securely than ever. Software,Subscription,Proprietary,N/A,"Germany, EU",Online,"English, German"
Freeform,"Freeform is a great place to bring your ideas to life. Sketch out a project, design a mood board or start a brainstorming session on a flexible canvas that supports almost any kind of file. And with iCloud, all your boards stay in sync, whether you’re on your Mac, your iPad or...",Freemium (Subscription),Proprietary,"Mind Mapping Tool, Note-taking Tool",United States,"Mac, iPhone, iPad","English, German, French"
Womp,"Womp is a free and beginner friendly browser based 3D design software, allowing anyone to easily create professional and 3D printing ready creations live from virtually any device and without any technical knowledge. FreeVPN services",Free,Proprietary,3D Modeler,United States,Online,English
Fey,"Fey is a top-tier, ad-free investment research tool with data from Nasdaq and S&P Capital, offering quality features, regular updates, and balanced affordability. Unlike expensive platforms, Fey Command allows real-time portfolio management, transaction viewing, and order...",Freemium,Proprietary,Stock Trading App,United States,Online,English
ZIMjs,"ZIM is a general JavaScript Framework for the HTML Canvas. You can make visually rich games, apps, puzzles, visualizations and art. ZIM provides conveniences, components and controls such as: MobileApps & Add-Ons",Free,Open Source,N/A,Canada,Online,English
Onion Mail,"Free anonymous email platform offering automatic PGP encryption, dedicated Tor .onion address, strict no-logs policy, no personal data or phone required, and anonymous payments through Monero, Bitcoin, Ethereum, or credit card. Compatible with Tor and web browsers. Freeware& Shareware",Freemium (Subscription),Proprietary,"WebMail Provider, Email Client",United States,Online,English
Countingup,Countingup is a business current account and accounting software in one easy-to-use app. Software,Paid,Proprietary,Online Banking Tool,United Kingdom,"Online, Android, iPhone, Android Tablet, iPad",English
URVA Connect,"URVA Connect - the omnichannel platform that centralizes conversations from messaging service, like WhatsApp, FB Messenger, Instagram DM, SMS, and more, all from a single interface.",Subscription,Proprietary,N/A,India,"Online, Android, iPhone",English
TradeAnvil,"TradeAnvil is one of the most advanced stock trading journal & analytical trade insight platforms on the market today, designed to give the modern trader access to trade insight to improve their current trading edge.",Subscription,Proprietary,Stock Trading App,N/A,Online,English
TheDayBefore,"With The Day Before, you won't miss precious moments in your busy daily life.",Freemium (Pay once),Proprietary,Calendar App,United States,"Android, iPhone, Android Tablet, iPad","English, Chinese, Japanese, Korean, Spanish, Vietnamese"
Geovelo,"Geovelo, your free GPS application, your statistics and your challenges!. Freeonline tools",Free,Proprietary,GPS Navigation Service,"France, EU","Online, Android, iPhone","English, Danish, Dutch, French, Catalan; Valencian, Finnish, German, Italian, Norwegian Bokmål, Portuguese, Swedish, Spanish"
PDFgear,"Read, edit, convert, merge, and sign PDF files across devices, for completely free and without signing up. Business& Productivity Software",Free,Proprietary,"PDF Reader, PDF Editor",Singapore,"Mac, Windows, Online, Android, iPhone, Android Tablet, iPad","English, German, Dutch, French, Italian, Japanese, Korean, Portuguese, Russian, Chinese, Spanish"
snApp,"snApp is a powerful window management utility, built for the Mac. At its core, it is powered by the award-winning Siri Shortcut, Snap.  MacOS",Free,Open Source ( CC0-1.0 ),Window Manager,United Kingdom,Mac,English
Mainlend,"Mainlend is a company delivering comprehensive software that streamlines the lending process from application to financing and finally loan servicing. There are two major systems, Loan origination and Loan Management, that are powered by an automated decision engine and loan... Newsoftware releases",Paid,Proprietary,N/A,N/A,Online,English
Censius,Censius is an AI Observability Platform that helps organizations of all scales confidently make their machine learning models work in production. The company launched its flagship AI observability platform that helps bring accountability and explainability to data science...,Subscription,Proprietary,N/A,N/A,Software as a Service (SaaS),English
Feedback Fiesta,"Feedback Fiesta is a minimalistic widget you can put into every website and lets users give feedback, ideas or bug reports.",Freemium (Subscription),Proprietary,Customer Feedback Manager,N/A,Online,English
Artykul,Read your favorite sites in one app and without noise. Stay in touch with what's happening in your favorite interests. Artykul is an RSS reader with a best-in-class native reader. Software,Freemium (Subscription),Proprietary,RSS Reader,N/A,"Mac, iPhone, iPad","English, Belarusian, French, German, Italian, Polish, Russian, Ukrainian"
Prime MLM Software,"At Prime, we envision a future where multi-level marketers will have access to tailored software solutions — this will allow them to succeed in the industry. We aim to deliver software solutions for MLM businesses that are practical and affordable. Software",Paid,Proprietary,N/A,N/A,"Mac, Windows, Android, iPhone, Android Tablet, iPad, Software as a Service (SaaS)",English
Roketfy,"Analyze your listings, content, competitiors, prices on Etsy with the Roketfy technologies and get smart suggestions to boost your sales!",Subscription,Proprietary,N/A,N/A,Online,English
sags.digtial,Record webcam & screen videos or voice messages directly in your browser (no software installation needed). Then instantly share by sending a simple link. WebBrowsers,Freemium (Subscription),Proprietary,"Screen Recorder, Video Sharing Tool","Germany, EU","Online, Trello, Software as a Service (SaaS)","English, German"
ScreenshotX,"ScreenshotX is a new, lightweight app for Windows for creating beautiful screenshots. It's freeware, it doesn't come with any spyware and you can also share your screenshots without the need to register or any other nonsense. Applicationsoftware reviews",Free,Proprietary,Screenshot Capture Tool,United States,Windows,English
Stych,"Stych is an app that lets you create amazing video diary memories. It's super easy to use and you can make videos of any length. You can also add photos, music, and even your own voice to your videos. Software",Free,Proprietary,N/A,N/A,"Online, Android, Software as a Service (SaaS)",English
OpenAndroidInstaller,OpenAndroidInstaller is a graphical installer that makes installing alternative Android distributions nice and easy.,Free,Open Source ( GPL-3.0 ),N/A,N/A,"Android, Android Tablet",English
TapOnn,"Introducing TapOnn - the ultimate digital networking tool for business professionals. With just one tap using NFC technology, you can instantly exchange card information with other users, build valuable relationships and expand your professional network.",Free,Proprietary,N/A,N/A,Android,English
AutoMealPlanner,AI meal plan generator with macros and food preferences.,Freemium (Subscription),Proprietary,N/A,United States,Online,English
CronTool,Sometimes even one cron is hard to visualise in the span of months. This tool aims to give you some piece of mind instead of waiting for weeks to see something is not working quite right.,Free,Proprietary,N/A,N/A,Online,English
Voiceline,"Work with voice. Anywhere. No typing, no meetings.",Subscription,Proprietary,N/A,"Germany, EU",Online,English
Saikou,"Saikou is crafted based on simplistic yet state-of-the-art elegance. It is an Anilist only client, which also lets you stream-download Anime & Manga.",Free,Open Source ( GPL-3.0 ),N/A,N/A,Android,English
welle.io,welle.io is an open source DAB and DAB+ software defined radio (SDR). It supports high DPI and touch displays and it runs even on cheap computers like Raspberry Pi 2+ and 100€ China Windows 10 tablets. Software,Free,Open Source,N/A,N/A,"Mac, Windows, Linux, Android, Flathub, Flatpak","English, German, French, Italian, Polish, Russian, Norwegian Bokmål, Hungarian"
77Market,"Tried and tested reliable platforms for web and mobile with up to 2000 assets – stocks, commodities, forex, indices. With multi-lingual client support standing by 24/5 to give assistance for account holders.",Free,Proprietary,N/A,N/A,"Online, Android",English
Wonderchat,"Enable AI chatbots derived from links, PDFs, and knowledge bases to automate support and sales. Quick setup without coding enhances customer interaction by reducing queries up to 70%. Customizable bots escalate issues, offer analytics, and improve through training.",Subscription,Proprietary,Chatbot Builder,N/A,"Online, Software as a Service (SaaS)",English
Dropboard,"Dropboard enables comprehensive hiring management with features like customizable forms, auto scheduling, resume parsing, kanban boards, and agency-friendly tools for full job site setup, candidate sourcing, and tiered service levels, offering unmatched ease in recruitment.",Subscription,Proprietary,N/A,N/A,"Online, Software as a Service (SaaS)",English
Workwolf,"Workwolf® is hiring software that filters applicants 200X faster than a human can. Using proprietary technology to screen and verify backgrounds, the platform automates the recruitment process, bringing unmatched efficiencies to the employment market. Software",Pay once or Subscription,Proprietary,HRM Software,N/A,"Windows, Online, Google Chrome, Software as a Service (SaaS)","English, French, Spanish"
HeadshotPro,"AI-photographer generates 120+ stunning headshots per user offering various styles. Perfect for LinkedIn, websites, marketing. Download high-res images. Effortlessly team-oriented setup with email invitations and easy selfie uploads.",Pay once,Proprietary,AI Image Generator,United Kingdom,"Online, Software as a Service (SaaS)",English
Cheq Essentials,"Cheq Essentials is a software that uses advanced algorithms and real-time monitoring to detect and block harmful sources, conducting over 2,000 security tests per visit. Newsoftware releases",Paid,Proprietary,Bot Protection Service,Israel,"Online, Software as a Service (SaaS), Wordpress",English
timegram,timegram is a time tracking and project planning tool that allows businesses to manage and enhance the productivity of remote and hybrid teams.,Freemium (Subscription),Proprietary,N/A,N/A,"Online, Google Chrome, Software as a Service (SaaS)",English
Môveo,"Môveo.AI is a no-code platform that allows businesses to create, manage and deploy AI virtual agents (chatbots). The virtual agents can handle complex use cases, understand and respond to customer inquiries, and integrate with external systems.",Free,Proprietary,N/A,N/A,Online,English
Document Node,"Built-in Mind Map for Markdown, working on your local folders of plain text Markdown files, distraction-free writing experience and multiple exporting options make Document Node your better choice of a writing tool.",Freemium (Subscription),Proprietary,N/A,N/A,"Mac, Windows, Linux",English
Poseit,Poseit is a mobile app that allow you to pose a wooden mannequin to facilitate and help you drawing or preview the human figure. Mobileapp discovery,Freemium,Proprietary,N/A,N/A,"Android, iPhone, Android Tablet, iPad",English
Shadow Warrior (Reboot),"Shadow Warrior is a series of first-person shooter video games that focuses on the exploits of Lo Wang, a modern ninja warrior who fights through hordes of demons.",Pay once,Proprietary,First-Person Shooter,"Poland, EU","Mac, Windows, Linux, Playstation, Xbox",English
Safes School,Schools can easily manage and monitor their online activities with Safes School. The app uses advanced technology to filter harmful and inappropriate content and protect students from online dangers. Software,Subscription,Proprietary,N/A,"Germany, EU",Software as a Service (SaaS),English
Sanvello,"Whether you’re feeling anxious, lonely, overwhelmed, or just burned out, Sanvello will meet you where you’re at. Think of it as your feel-better toolkit, including therapy, coaching, coping techniques, meditations, and goal and mood tracking, designed by experts to help you feel...",Freemium (Subscription),Proprietary,N/A,United States,"Android, iPhone, iPad, Apple Watch",English
PoseMy.Art,Simple and powerful 3D model poser with a huge animations/poses library that helps you create pose reference for your art.,Pay once or Subscription,Proprietary,N/A,N/A,Online,English
Cloud Development Environment,"Cloud based simple, secure and ready to code workspaces, assuring high performance & fully configurable coding environment.",Free,Proprietary,N/A,N/A,"Software as a Service (SaaS), LEDE - Linux Embedded Development Environment",English
Doctor Droid,Doctor Droid is a software tool designed to facilitate the creation of funnels from application logs. It provides a proactive approach to system monitoring by enabling users to define correlations in the form of these funnels. Software,Freemium (Subscription),Open Source ( MIT ),N/A,N/A,Software as a Service (SaaS),English
Any Distance,"Any Distance is your ultimate running, walking, hiking, and biking workout tracker designed to track and elevate your fitness regime.",Freemium,Proprietary,"Run Tracker, Fitness Tracker",United States,"iPhone, Apple Watch",English
Prodeus,"Prodeus is a first-person shooter of old, re-imagined using modern rendering techniques and technology. Experience the quality you’d expect from a modern AAA game, designed with retro aesthetics and gameplay that invoke the tech-imposed limits of older hardware.",Pay once,Proprietary,First-Person Shooter,Canada,"Mac, Windows, Steam, GOG.com, Playstation, Nintendo Switch, Xbox, Humble Bundle",English
EasyOS,EasyOS is an experimental Linux distribution that uses many technologies and package formats pioneered by Puppy Linux .,Free,Open Source,"Linux Distro, Operating System",Australia,Linux,"English, French, German, Bulgarian, Czech, Danish, Greek, Spanish, Estonian, Finnish, Croatian, Hungarian, Icelandic, Italian, Lithuanian, Latvian, Macedonian, Dutch, Norwegian, Polish, Portuguese, Romanian, Russian, Slovak, Slovene, Albanian, Serbian, Swedish, Turkish, Ukrainian, Uzbek, ▾"
Web Translate,"Web Translate is a tool designed to integrate with your web browser or Thunderbird, providing seamless access to a variety of popular translation services. It is primarily aimed at facilitating quick translations directly from your browser, negating the need to navigate to a...",Free,Proprietary,Translator,"Slovakia, EU","Microsoft Edge, Vivaldi Browser, Google Chrome, Thunderbird, Opera, Brave, Firefox",English
Horse,"A web browser using Trails for organizing pages, projects, and tasks within a sidebar. Tailored for professionals to save time, boost productivity, and efficiently manage online workflows without traditional tabs or bookmarks. WebBrowsers",Subscription,Proprietary,Web Browser,"Estonia, EU","Mac, Windows, Linux",English
GPTMac,GPTMac is a simple app for macOS that lets you quickly access chatGPT from your Mac.,Pay once,Proprietary,N/A,"Sweden, EU",Mac,English
Stables,"With a community of over 25,000 across the globe, Stables allows users to spend, send and earn stablecoins all on one balance. Stables focused on bringing real-world use cases to digital assets. Powered by Mastercard, Australian users can pay with their USDC via Apple and Google Pay.",Free,Proprietary,N/A,N/A,"Android, iPhone","English, Chinese"
TrackWallet,TrackWallet is a money manager and expense tracker app that helps you quickly track personal finances and manage budgets on the go.,Freemium (Pay once or Subscription),Proprietary,"Budget Manager, Personal Finance Tool","Lithuania, EU",Android,English
SubPage,"SubPage helps you create important pages for your website as easy as filling a form that are otherwise tough to create or maintain with your existing website builder. Create pages like FAQ, glossary, policies, careers and more with no-code and no-design.",Freemium (Subscription),Proprietary,Website Builder,India,Online  ,English
CartoSVG,Design gorgeous and lightweight SVG maps with ease.,Free,Open Source,N/A,"France, EU","Online, Self-Hosted",English
WaveBar,WaveBar transforms your music experience with dynamic visualizations on your Mac.  MacOS,Free,Proprietary,N/A,N/A,Mac,English
Ai SuitUp,"Transforms selfies into professional business headshots with artificial intelligence, creating up to 200 high-definition images in 15 styles, delivered within hours. Ensures data privacy with automatic deletion and offers a range of photorealistic options for diverse uses.",Pay once,Proprietary,N/A,United States,Online,English
Multilings,"Multilings is a neural AI based machine learning service which gives the best human like output for text translation, content writing, plagiarism and voice translation etc. Best for Marketers, Content Writers, Researchers, Students and everyone.",Subscription,Proprietary,N/A,N/A,Online,English
Rila • Social Home Discovery,"Welcome to Rila! A free app where the community of agents, home seekers and creators suggest and discover great listings together. Rila is designed to put the power of home discovery back in your hands. Opensource software",Free,Proprietary,N/A,United States,"iPhone, iPad",English
ScaleXP,ScaleXP is a cloud-based reporting software that simplifies financial and CRM systems into a single dashboard for data-driven decision-making and business growth. Newsoftware releases,Subscription,Open Source,N/A,N/A,"Online, Software as a Service (SaaS)",English
TheFor: Habit Tracker,"Powerful habit tracking app that helps you form and maintain healthy habits, boost productivity, and achieve self-improvement goals. Mobileapp discovery",Freemium,Proprietary,Habit Tracker,N/A,"Android, iPhone, Android Tablet, iPad",English
Sourcetable,"Spreadsheet syncs with databases and business applications, enabling access to live business data, custom reporting, visualization, and analytics for various roles such as operators, marketers, analysts, and sales teams, including integrations with popular tools. Applicationsoftware reviews",Freemium (Subscription),Proprietary,Spreadsheet App,United States,"Online, Microsoft Edge, Google Chrome, Safari, Mozilla Firefox",English
Vaulteron,Vaulteron is the open source password manager for companies with security-critical requirements. Our central password management protects your passwords and is shareable with your employees.,Free Personal,Open Source,Password Manager,"Germany, EU",Online,"English, German"
Connect You,Contacts app for Android using MD3. Mobileapp discovery,Free,Open Source ( GPL-3.0 ),Contact Manager,"Germany, EU","Android, Android Tablet, F-Droid",English
Docz,Zero config documentation static website generator.,Free,Open Source ( MIT ),Documentation Generator,N/A,"Linux, Node.JS, npm",English
Juky,Juky is a shared Spotify queue for your party where all guests at your party can vote for tracks to play. Let your guests set the mood with the perfect music everyone likes!.,Freemium (Pay once or Subscription),Proprietary,N/A,N/A,"Online, Android, iPhone  ",English
Myne (eBook),"Myne is a FOSS Android application to download ebooks from the Project GutenBerg, it uses GutenDex API to fetch metadata of ebooks in the backend. AndroidOS",Free,Open Source ( Apache-2.0 ),Ebook Library,International,"Android, F-Droid",English
Nitrobox Monetization Platform,"Nitrobox is a SaaS solution helping enterprises and scaling startups to automate their complex revenue processes and build smart billing and pricing models, such as subscriptions, pay-per-use, digital one-time transactions, or any hybrid model.",Subscription,Proprietary,Billing System,"Germany, EU","Online, Software as a Service (SaaS)","English, German"
Rephrasee.com,"Rephrasee.com utilizes Artificial Intelligence to help you with rephrasing, translating, and proofreading. Get the highest quality help with your written content, quickly and accurately with AI-powered technology.",Freemium (Pay once),Proprietary,N/A,N/A,Online  ,"English, Czech, Spanish, German, Polish, Italian, Danish, Afrikaans, Arabic, Armenian"
RunDiffusion,RunDiffusion lets you run a feature-packed and updated version of Stable Diffusion online by renting performant cloud computing on an hourly basis. Use the latest and greatest Stable Diffusion apps and models and generate unlimited images at just an hourly cost. Software,Pay once,Proprietary,AI Image Generator,N/A,Online,English
xSTUDIO,"xSTUDIO is a modern, flexible and feature-rich Playback and Review application designed to meet the needs of content creators throughout the production process. The application has been carefully engineered to meet the diverse needs of a broad range of review scenarios, whether... Software",Free,Open Source ( Apache-2.0 ),N/A,United Kingdom,"Mac, Windows, Linux",English
4.Do: Task & To Do List,4.Do is a decision making tool to organize your tasks and goals based on their importance and urgency.,Freemium (Subscription),Proprietary,"Todo List Manager, Task Management Tool",N/A,Android,"English, French, Arabic, German, Spanish, Hindi, Chinese, Italian, Japanese, Korean, Russian"
Curated Design,Curated Design is a web design inspiration catalog that aggregates diverse and creative web design examples from across the internet.,Free,Proprietary,Graphic Design Tool,Ukraine,Online,English
Deltarune,"Deltarune is a role-playing video game developed by Toby Fox. The player controls a teenage human, Kris, who is destined to save the world together with Susie, a monster, and Ralsei, a prince from the Dark World.",Pay once,Proprietary,Role-playing Game,United States,"Mac, Windows, Steam, Playstation, Nintendo Switch","English, Japanese"
