title,description,cost,license,app_type,origin,platform,supported_languages
LBalance,LBalance is an app that uses the acceleration sensors of the device to move graphical objects on the screen. LBalance can also be used as a protractor or spirit level. MobileApps & Add-Ons,Free,Open Source ( GPL-3.0 ),N/A,N/A,"Android, F-Droid",English
Glee,"Glee publishes Markdown files into Ghost blog posts. With glee, you can create and update Ghost blogs. Since glee operates on plain markdown files, your blog posts are now git-friendly, allowing for easy collaboration.",Free,Open Source ( MIT ),N/A,N/A,"Ghost, Mac, Linux, Self-Hosted",English
Convert 3D,"Convert 3D converts 3D models from a wide range of formats. No need to buy expensive software or install anything. Convert 3D converts between popular formats like FBX and OBJ, but also the lesser known formats you might have received from a coworker or supplier. Newsoftware releases",Freemium (Subscription),Proprietary,N/A,N/A,Online,English
Notepad App,"A markdown-based notes app for macOS, with simplicity and moderation. Applicationsoftware reviews",Free,Proprietary,"Note-taking Tool, Text Editor",N/A,Mac,English
OptiClean,"OptiClean is an AI-powered photo retouch app that effortlessly removes unwanted people, objects, text, logos, or watermarks from your image with just a few clicks. Compared to traditional tools, OptiClean's AI recreates realistic backgrounds without the need for selecting a...",Pay once,Proprietary,"Image Editor, Photo Editor",N/A,Mac,"English, Chinese"
Menu Bar Calendar,Quickly access a monthly calendar from your menu bar.,Free,Proprietary,Calendar App,Norway,Mac,English
Plan Harmony,"Collaborative trip planning app 🛫 Build your trip itinerary, set your budget, enjoy your trip. Bring harmony to planning vacations with friends & family!. Software",Freemium (Pay once),Proprietary,Travel Planner,N/A,Software as a Service (SaaS),English
Bluedot,"Bluedot is an AI-powered meeting recorder. With Bluedot, you can easily summarise, organize, and share your meeting recordings and company videos helping teams across the whole company stay organized and connected.",Freemium (Subscription),Proprietary,N/A,United States,"Google Chrome, Google Meet","English, Portuguese, Spanish, Dutch, Polish, French, German"
Bug ID,"Bug ID is an app that identify insects,bug,spiders,ants,bees and more bugs that you want to recognize. insect identifier is a is an easy-to-use to take a picture or upload from your gallery to identify your insect. Applicationsoftware reviews",Freemium (Subscription),Proprietary,N/A,N/A,"iPhone, iPad",English
Autonix,"All-in-one dynamic QR code platform offering scan analytics, roles and permissions, customizable styles, advanced code types for check-ins, vCards, WiFi, API access, secure data privacy, scalable management, and seamless visitor tracking for any organization.",Freemium (Subscription),Proprietary,QR Code Generator,United States,Online,English
Moments,Personal Relationship Manager.,Freemium (Subscription),Proprietary,"CRM System, Contact Manager","Netherlands, EU",iPhone,English
Vizard.ai,"Cloud-based AI video editor creates short clips for TikTok, YouTube Shorts, Instagram Reels, automates editing, adds subtitles, headlines, captions, supports multitasking, multiple formats, fast processing, translation, direct publishing, easy-to-use interface.",Freemium (Subscription),Proprietary,Video Editor,United States,Online,English
SleepCalculator.info,A sleep calculator is your personal sleep guidance tool. It is a calculator designed to help you find the perfect bedtime and wake-up time based on your unique sleep cycles and preferences.,Free,Proprietary,N/A,N/A,Online,English
Teamcamp,"Discover comprehensive project management with Teamcamp. It offers real-time collaboration, task tracking, invoicing, centralized storage, and workflow automation. Manage multiple workspaces effortlessly, ensuring seamless project coordination and financial management, ideal for global enterprises.",Freemium (Pay once or Subscription),Proprietary,"Project Management Tool, Task Management Tool",India,"Mac, Windows, Online, Android, iPhone, Android Tablet, iPad",English
Shkiper Notepad,"The shkipper is designed to make your life easier and organize your daily activities. Take notes, schedule reminders with flexible repeat modes (daily, weekly, monthly, yearly) and don't forget important events.",Free,Open Source,"Journaling App, Note-taking Tool",N/A,Android,English
AWS Identity and Access Management,"With AWS Identity and Access Management (IAM), you can specify who or what can access services and resources in AWS, centrally manage fine-grained permissions, and analyze access to refine permissions across AWS.",Free,Proprietary,Identity Management Tool,United States,"Software as a Service (SaaS), Amazon Web Services",English
consentmanager,"Cookie consent management platform with compliance for GDPR, CPRA and more. Customizable design with built-in cookie crawler. As a certified Google CMP partner, customers can seamlessly activate Google Consent Mode v2. IAB Europe validated and TCF 2.2 compliant.",Freemium (Subscription),Proprietary,"Cookie Manager, Privacy Tool","Sweden, EU","Online, Software as a Service (SaaS), Wordpress","English, German, French, Spanish, Swedish, Polish, Czech, Danish, Dutch, Finnish, Greek, Hungarian, Icelandic, Italian, Latvian, Lithuanian, Portuguese, Romanian, Russian, Slovene, Bulgarian, ▾"
Advanced Google Play Search,Filter & sort Google Play search results.,Free,Open Source,N/A,N/A,Online,English
PDF Room,"PDF Room is an online platform that allows users to access a wide array of PDF files covering numerous subjects. PDF Room provides an efficient and user-friendly interface for browsing and downloading PDFs, from scholarly articles to eBooks, user manuals, and technical documents.",Free,Proprietary,N/A,N/A,Online,"English, Spanish"
Audiorista,"Elevate your digital content business with Audiorista, the native app platform for creating personalized media apps with zero coding skills required. Ideal for podcasters, educators, and media companies, Audiorista allows you to effortlessly design, monetize, and engage your... Software",Subscription,Proprietary,N/A,"Denmark, EU",Online,English
Pexip,"Flexible video technology that powers everything from business communication to ultra-secure government meetings, doctor’s appointments, and court proceedings.",Subscription,Proprietary,"Web Conferencing Tool, Video Calling App",N/A,"Software as a Service (SaaS), Self-Hosted, Windows, Mac, Linux, iPhone, Android, iPad, Android Tablet","English, Japanese, Russian"
Contacts Import,"Import your CSV contacts from your favourite desktop client without any cloud syncing. Multi-language fully supported including all common localised codepages (from US & Westen Europe to Eastern Europe to China and Japan) and also UTF, so you get your contact information...",Free,Open Source ( Apache-2.0 ),N/A,N/A,"Android, F-Droid",English
Gojekyll,"Gojekyll is a partially-compatible clone of the Jekyll static site generator, written in the Go programming language. It provides build and serve commands, with directory watch and live reload.",Free,Open Source ( MIT ),Static Site Generator,N/A,"Mac, Windows, Linux, Self-Hosted",English
Chained Echoes,"A classic 2D RPG with Swords, Magic and … Mechs. Take up your sword, channel your magic or board your Mech as you follow a group of heroes on their journey through the war-ridden land of Valandis.",Paid,Proprietary,"Role-playing Game, Adventure Game","Germany, EU","Windows, Steam, Playstation, Xbox, Nintendo Switch, Online, Mac",English
Sea of Stars,"Sea of Stars is a turn-based RPG that combines traditional influences with modern mechanics. It includes Eclipse Magic, interactive environments, strategic combat, platformer-inspired navigation, and original characters and story arcs in a pixel-art world.",Pay once,Proprietary,Role-playing Game,Canada,"Windows, Steam, Playstation, Nintendo Switch, Xbox",English
Rocketfuel Crypto,"An actual community of crypto enthusiasts - no scammers or spammers. Since 2017, we've provided education, analysis, and community support. Currently 10,000 members strong in 104 countries. Join us!.",Freemium (Subscription),Proprietary,N/A,N/A,"Online, iPhone, Android",English
Geekttrss,Geekttrss is an Tiny Tiny Rss reader application with transparent offline mode for the Android platform.,Free,Open Source ( GPL-3.0 ),RSS Reader,Martinique,"Android, F-Droid",English
Baby on Board,Baby on Board is a pregnancy tracking application that respects your liberty and privacy. Applicationsoftware reviews,Free,Open Source,N/A,N/A,"Android, F-Droid  ",English
Eternity,"A client for Lemmy, specifically designed for Android and written in Java. This project is a fork of the Infinity for Reddit project, and it is currently in the early stages of development. As such, expect many unfinished features and potential bugs! AndroidOS",Free,Open Source ( AGPL-3.0 ),Lemmy Client,International,"Android, F-Droid",English
Top 1000 Repos,"Browse the top 1000 GitHub repositories based on stars, pull requests, and issues. Hide repos that you don't need, they stay hidden every time you open the page. See the top pull requests and issues closed in the last 12 months of each repository.",Free,Proprietary ( MIT ),N/A,N/A,Online,English
Goodbye Volcano High,"Goodbye Volcano High is a cinematic narrative adventure about love, change, and the end of the world. Guide Fang through their final year of high school as they try to make things right before time is up.",Pay once,Proprietary,"Music Game, Adventure Game",Canada,"Windows, Steam, Playstation","English, Spanish"
Decision,"Decision is the platform where better, faster decisions happen. For a traceable past & an impressive future. Now with AI!.",Paid,Proprietary,N/A,N/A,Online,English
Practice a Language,"Practice having a conversation in the language that you want to learn by speaking and writing with OpenAI's GPT-3.5. If you're still learning the language, then you can write your response in your native language and it will be translated to the language that you want to...",Free,Open Source,Language Learning Tool,N/A,Online,"English, French, German, Spanish, Afrikaans, Albanian, Arabic, Bosnian, Bulgarian, Croatian, Czech, Danish, Dutch, Estonian, Finnish, Greek, Hebrew, Hindi, Hungarian, Icelandic, Indonesian, Italian, Japanese, Korean, Latin, Latvian, Malay, Norwegian, Polish, Portuguese, Romanian, Russian, Serbian, Slovak, Swedish, Tamil, Thai, Turkish, Ukrainian, Vietnamese, ▾"
Planta,You’re only one tap away from your personal jungle - Take a photo of your plant and Planta takes care of the rest!,Freemium (Subscription),Proprietary,N/A,"Sweden, EU","Android, iPhone","English, Danish, Dutch, French, German, Italian, Japanese, Korean, Norwegian Bokmål, Norwegian Nynorsk, Spanish, Swedish"
AndrOpen Office,"AndrOpen Office is a independent port of Apache OpenOffice for Android. AndroidOS




You can view, edit, import, and export PDF, Word, Excel & PowerPoint documents using full features of the OpenOffice in the PC version.




AndrOpen Office has 5 components:
Writer a word processor you can.",Freemium,Open Source ( Apache-2.0 ),"Word Processor, Spreadsheet App",Japan,"Android, Android Tablet",English
Private Camera App,"This app allows you to take photos, encrypt them on the go & share them securely on a zero-knowledge server, away from your phone. Each photo is automatically end-to-end encrypted and sent to a dedicated Album in a protected Cloud. You can also share your photos with other trusted users.",Freemium (Subscription),Proprietary,Photo Sharing App,"Poland, EU","Android, iPhone",English
An Light,"A simple flashlight application, include flashlight, stroboscope, SOS, screen flashlight, morse code. Software",Free,Open Source ( GPL-3.0 ),N/A,N/A,"Android, F-Droid",English
Learn.xyz,"Feed your brain, not the algorithm. Use the power of AI to create lessons, share them, and inspire others.",Free,Proprietary,Online Education Service,United States,Online,English
Passy,"Store passwords, payment cards notes, ID cards and identities offline and safe, synchronized between all of your devices.",Free,Open Source ( GPL-3.0 ),Password Manager,International,"Windows, Linux, Online, Android, Snapcraft, Microsoft Edge, Google Chrome, Flathub, F-Droid",English
Deku SMS,"Deku SMS is a feature-rich, open-source default SMS app designed to enhance your messaging experience while prioritizing your privacy and security. With Deku SMS, you can seamlessly send and receive end-to-end encrypted SMS messages, ensuring that your conversations remain... Software",Free,Open Source ( GPL-3.0 ),Instant Messenger,International,"Android, F-Droid",English
Webstudio,Open source website builder that empowers creators to build highly maintainable and fast websites using modern web standards. Webstudio is an Open Source version of Webflow. Dictionaries& Encyclopedias,Freemium (Subscription),Open Source ( AGPL-3.0 ),Website Builder,United States,"Online, Self-Hosted, Docker, Windows",English
Whapi.Cloud,"Delivers easy WhatsApp integration for developers via a REST API. Features include CRM, ERP support, detailed tutorials, JSON compatibility and comprehensive support for novice to experienced programmers.",Pay once,Open Source,N/A,N/A,"Online, Software as a Service (SaaS)","English, Russian, Portuguese, Spanish, Turkish, Romanian"
Material Flashlight,Flashlight application for android with some cool features. Software,Free,Open Source ( Apache-2.0 ),N/A,N/A,"Android, F-Droid",English
Zoho Voice,Zoho Voice is a cloud-based contact center solution that helps you with wider and deeper call scaling options. You can now secure and streamline your call traffic and get real-time data analytics to manage the effectiveness of your workforce.,Freemium (Subscription),Proprietary,N/A,India,"Online, Android, iPhone, Google Chrome, Software as a Service (SaaS), Firefox",English
Overture Maps,"Powering current and next-generation map products by creating reliable, easy-to-use, and interoperable open map data.",Freemium (Pay once),Proprietary,Map Service,"Germany, EU",Online,English
BAANDY,"BAANDY is the platform that lets you travel more for less - make the most of the remote work revolution and travel more authentically by finding people to swap your home with. Everyday, BAANDY brings people closer together who need to break from the mundane without breaking the...",Freemium (Subscription),Proprietary,"Accommodation Rental Service, Travel Planner",N/A,"Android, iPhone, Windows Mobile",English
Alexandria E-Book Reader,A minimalistic cross platform eBook reader.,Free,Open Source ( GPL-3.0 ),N/A,N/A,"Windows, Linux",English
Synthesis Tutor,Your child's superhuman tutor. Show your child they can learn anything. Synthesis Tutor is the educational AI that actually works. Scroll to discover for yourself.,Subscription,Proprietary,N/A,United States,Online,English
ImagenMIA.com,Generate cool profile pictures in various styles using AI.,Pay once,Proprietary,N/A,N/A,Online,"English, Spanish"
FlairMax,"FlairMax is a music recognition Windows app that gives you some information on the recognized track like title, duration, genres, artist, release date, album, recognized part time offset, synced lyrics, music links and more... MobileApps & Add-Ons",Free,Proprietary,Music Recognition App,N/A,Windows,English
Solid Calendar,Solid Calendar is a minimalist calendar app with natural language processing and 6 carefully designed layouts to make staying on top of your schedule a breeze. Applicationsoftware reviews,Pay once,Proprietary,"Calendar App, Todo List Manager",N/A,"Mac, iPhone, iPad","English, Arabic, Catalan; Valencian, Croatian, Czech, Danish, Dutch, Finnish, French, German, Greek, Hebrew, Hindi, Hungarian, Indonesian, Italian, Japanese, Korean, Malay, Norwegian Bokmål, Polish, Portuguese, Romanian, Russian, Chinese, Slovak, Spanish, Swedish, Thai, Turkish, Ukrainian, Vietnamese, ▾"
March Health,"Experience a personalized menstrual health journey with in-depth cycle tracking, symptom support, expert-backed recommendations, privacy-focused design, and engaging gamified health goals.",Subscription,Proprietary,N/A,N/A,"Android, iPhone, Android Tablet, iPad",English
Clipboard Canvas,"A tool that helps you be productive, preview multiple files on Infinite Canvas, save storage space with smart Reference Files, and work uninterruptibly with Autopaste.",Free,Open Source ( GPL-3.0 ),N/A,N/A,Windows,English
Oneflow,"Oneflow is a digital contract software that transforms the outdated contract process into a wonderfully connected pre-sign, sign, and post-sign digital experience.",Freemium (Subscription),Proprietary,E-signature Tool,"Sweden, EU",Software as a Service (SaaS),"English, Spanish, Dutch, French, Norwegian, Finnish, Swedish, Portuguese, Italian, German"
Base for Music,Launch ad campaigns to reach new audiences and develop a community of engaged fans. Our technology allows you to easily launch complex ad campaigns on different networks. Our tool allows our team to optimize your budget on a daily basis and to find your new fans for you.,Freemium (Subscription),Proprietary,N/A,N/A,Online,"English, French"
Widgetable,"Widgetable provides trending widgets on your lock and home screen, including pet widgets, plant widgets, social widgets for friends and couples, mood bubbles, dynamic icons, app launching widgets and contact shortcuts. Applicationsoftware reviews",Freemium (Pay once or Subscription),Proprietary,N/A,N/A,"iPhone, Android","English, Chinese, French, German, Italian, Japanese, Korean, Portuguese, Russian, Spanish"
Remove Objects,Easily remove any thing from your photos with 100% satisfaction guaranteed.,Freemium (Pay once),Proprietary,N/A,United States,"iPhone, iPad, Android, Android Tablet","English, Chinese, French, German, Japanese, Korean, Spanish"
Want My RSS,An extension for Firefox that restores some of RSS functionality which Firefox abandoned. Functionality includes:,Free,Open Source,RSS Reader,N/A,Firefox,English
Gauthmath,"Gauthmath is an AI-powered application that provides solutions to complex math problems, offers a smart math calculator, and features 1-on-1 live tutoring with experienced tutors available round the clock. Software",Freemium,Proprietary,Math Solver,United Kingdom,"Android, iPhone","English, Indonesian, Malay, Portuguese, Spanish, Vietnamese"
Wino Mail,Wino is a lightweight native mail client for Windows 10/11. It is still in active development. Main motivation for this project is to replace Mail & Calendar for Windows with modern Windows design without using web technologies for speed.,Freemium (Pay once),Open Source ( GPL-3.0 ),Email Client,Türkiye,Windows,"English, Chinese, Czech, French, Italian, Greek, Indonesian, Portuguese, Russian, Romanian, Spanish"
Fediverse Redirect,"Deep linking proxy for Mastodon and Lemmy on Android, allowing you to launch your selected client automatically.",Free,Open Source ( MIT ),N/A,United States,Android,English
Git+ Coach,Git Coach is a Ads free education app designed to help users learn Git and explore its commands. Freeware& Shareware,Free,Open Source ( GPL-3.0 ),N/A,N/A,"Android, F-Droid  ",English
Tangent Notes,Tangent is designed to let you write the way you think. Your thoughts are connected; Tangent lets you link to existing notes and make new ones with ease.,Free,Open Source ( Apache-2.0 ),"Note-taking Tool, Todo List Manager",United States,"Mac, Windows, Linux, Flathub, Flatpak","English, Spanish"
Ultralight: Photo Video Editor,"Ultralight: Photo Video Editor is a tool for editing photos and videos. It offers full screen editing, filters, customizable presets, real-time previews, non-destructive editing, and direct media collection access.",Freemium (Pay once or Subscription),Proprietary,"Photo Editor, Image Editor","Finland, EU","iPhone, iPad","English, Arabic, Chinese, Danish, Dutch, Finnish, French, German, Hindi, Indonesian, Italian, Japanese, Korean, Malay, Norwegian Bokmål, Polish, Portuguese, Russian, Spanish, Swedish, Turkish, ▾"
Hypic - Photo Editor & AI Art,"Hypic is a user-friendly and versatile picture editing app. With Hypic, you will be able to edit and retouch your picture with ease on your device. Software",Freemium (Subscription),Proprietary,AI Image Editor,China,"Android, iPhone, Android Tablet, iPad","English, Chinese, Dutch, French, German, Indonesian, Italian, Japanese, Korean, Malay, Polish, Portuguese, Spanish, Swedish, Thai, Turkish, Vietnamese"
LiteBooks,"LiteBooks is an all-in-one business management tool for small businesses, offering features such as invoice generation, expense tracking, and detailed report creation, with iCloud sync and offline usage capabilities.",Freemium,Proprietary,Invoicing Software,N/A,"Mac, iPhone, iPad",English
Fudo,"Fudo provides the best protection for remote connections to Unix/Windows servers, databases, or web applications. With the Zero-Trust approach, users only have access to specific applications and accounts for a reason and when they really need it. Applicationsoftware reviews",Freemium (Subscription),Proprietary,Remote Desktop Tool,United States,Self-Hosted,English
STRICH,"STRICH is a JavaScript library for real-time, multi-format barcode scanning directly in the web browser. WebBrowsers",Subscription,Proprietary,Barcode Scanner,United States,Software as a Service (SaaS),English
Storia Textify,Textify is a tool for replacing the gibberish in AI-generated images with your desired text.,Free,Proprietary,N/A,N/A,Online,English
Prosper,Time Management & Task Organizer. The ultimate app to help you stay organized and manage your busy life effectively. MobileApps & Add-Ons,Freemium (Pay once or Subscription),Proprietary,Time Tracking Tool,"Lithuania, EU","Android, iPhone, iPad, Android Tablet","English, Arabic, Chinese, Dutch, French, German, Hindi, Italian, Japanese, Korean, Latvian, Norwegian Bokmål, Polish, Portuguese, Spanish"
Timelog - Timestamp Counter,"This is a simple timestamp logger, counter.",Free,Proprietary,Time Tracking Tool,N/A,"Android, iPhone","English, Korean"
Ubicloud,"Open, free, and portable cloud. Elastic compute, block storage (non replicated), and virtual networking services in public alpha.",Freemium (Subscription),Open Source ( AGPL-3.0 ),"Web Hosting Service, Cloud Computing Service",International,"Linux, Online, Self-Hosted, Software as a Service (SaaS)",English
Budget Flow,"Budget Flow lets you keep track of your income and expenses and manage them effortlessly. This modern and user-friendly expense tracking app is quick to set up, requires no registration and can even be used offline.",Freemium (Subscription),Proprietary,Budget Manager,N/A,"Mac, iPhone, iPad, Apple Watch","English, Bosnian, Chinese, Croatian, Czech, Danish, Dutch, Finnish, French, German, Greek, Hungarian, Indonesian, Italian, Japanese, Korean, Norwegian Bokmål, Polish, Portuguese, Romanian, Russian, Slovak, Spanish, Swedish, Thai, Turkish, Ukrainian, Vietnamese, ▾"
GpsGate Splitter,"Send the real-time data you need to as many apps as you want. Virtual COM ports let you share data from one GPS tracking device with several applications. GpsGate Splitter is ideal for enterprise deployments, police and fire departments, and other mobile workers with in-vehicle laptops. Mobileapp discovery",Pay once,Proprietary,N/A,"Sweden, EU",Windows,English
Rymdport,"Rymdport (formerly wormhole-gui) is a cross-platform application that lets you easily and safely share files, folders, and text between devices. The data is sent securely with end-to-end encryption using the same protocol as Magic Wormhole. Software",Free,Open Source ( GPL-3.0 ),Large File Transfer Service,N/A,"Mac, Windows, Linux, Flathub, FreeBSD",English
Resume Trick,Are you tired of struggling to create a professional resume that stands out? Look no further! Resume Trick is here to transform your job application process and skyrocket your chances of landing your dream job.,Free,Proprietary,Job Search Service,"Cyprus, EU",Online,English
Avtars,"Avtar is a free Ai website that user can use it. they provide many option like character ai chat, gpt chatbot online, conversational ai analytics, and many more. FreeVPN services",Free,Proprietary,N/A,N/A,"Online, iPhone, Android",English
Profile Switcher for Firefox,"Create, edit, delete and switch between browser profiles seamlessly in Firefox. Inspired by Chrome's profile switcher. WebBrowsers",Free,Open Source ( GPL-3.0 ),N/A,N/A,Firefox,English
FlakeHub,"Find, install, and publish Nix Flakes with FlakeHub.",Free,Open Source,N/A,United States,"Online, GitHub",English
BentoML,"BentoML is a framework for building reliable, scalable, and cost-efficient AI applications. It comes with everything you need for model serving, application packaging, and production deployment. Applicationsoftware reviews",Free Personal,Open Source ( Apache-2.0 ),N/A,United States,"Software as a Service (SaaS), Self-Hosted",English
OneDiffusion,"OneDiffusion is an open-source one-stop shop for facilitating the deployment of any diffusion models in production. It caters specifically to the needs of diffusion models, supporting both pretrained and fine-tuned diffusion models with LoRA adapters.",Free,Open Source ( Apache-2.0 ),N/A,United States,Self-Hosted,English
Screenshot Capture,Screenshot Capture / Browser Extension. WebBrowsers,Free,Open Source,Screenshot Capture Tool,N/A,"Google Chrome, Microsoft Edge",English
Bazzite,"Bazzite is a custom gaming Linux distro built from ublue-os/main and ublue-os/nvidia using Fedora technology, which means expanded hardware support and built in drivers are included. Linux& Unix",Free,Open Source ( Apache-2.0 ),"Linux Distro, Operating System",International,Linux,English
