title,description,cost,license,app_type,origin,platform,supported_languages
CleanMyPhone,"AI-powered tool scans mobile device storage, identifies and removes duplicate, blurred, or unnecessary images and videos, auto-sorts content into thematic folders, supports robust decluttering, conducts network speed testing, and helps organize digital photo libraries efficiently.",Freemium,Proprietary,"Duplicate File Finder, System Cleaner",Ukraine,"iPhone, iPad","English, Dutch, French, German, Italian, Japanese, Korean, Polish, Portuguese, Chinese, Spanish, Ukrainian"
Notes.ai,"Never miss a brilliant idea again: effortlessly transcribe meetings into Notion. Notes.ai + Notion = your ideas organized, your productivity unleashed.",Freemium (Pay once),Proprietary,Audio Transcription Tool,N/A,Mac,"English, Afrikaans, Amharic, Arabic, Bengali, Bulgarian, Catalan; Valencian, Chinese, Croatian, Czech, Danish, Dutch, Estonian, Finnish, French, German, Greek, Gujarati, Hebrew, Hindi, Hungarian, Indonesian, Italian, Japanese, Kannada, Korean, Lithuanian, Latvian, Malay, Malayalam, Marathi, Norwegian Bokmål, Persian, Polish, Portuguese, Romanian, Russian, Serbian, Slovak, Slovene, Spanish, Swahili, Swedish, Tamil, Telugu, Thai, Turkish, Ukrainian, Urdu, Vietnamese, ▾"
Linkeeper,"A URL bookmarking app, featuring deep integration into the OS, iCloud Sync, extensive Siri Shortcuts actions, and a stunning user interface that makes it a joy to use and feels like home. Software",Free,Proprietary,Bookmark Manager,United Kingdom,"Mac, iPhone, iPad, visionOS",English
Raccoon for Lemmy,Raccoon for Lemmy is a client for the federated aggregation and discussion platform Lemmy. The project is powered by Kotlin Multiplatform (KMP) and Compose Multiplatform (CMP).,Free,Open Source ( GPL-3.0 ),Lemmy Client,"Italy, EU","Android, F-Droid, GitHub",English
Supahub,"Supahub is a free customer feedback tool to collect, manage, and prioritize feature requests. No more lost or ignored feedback. FreeVPN services",Freemium (Subscription),Proprietary,Customer Feedback Manager,N/A,"Online, Software as a Service (SaaS)",English
MoodWise,"MoodWise is a simple moodtracker to help users understand and improve their emotional well-being. Track what you need and analyze your data with insightful graphs. MoodWise offers a clutter-free design, focusing on the essentials without overwhelming you with unnecessary features.",Freemium (Pay once),Proprietary,"Journaling App, Private Diary",N/A,"Android, iPhone, Android Tablet, iPad",English
TabbyML,"Tabby is an open-source, self-hosted AI coding assistant. With Tabby, every team can set up its own LLM-powered code completion server with ease.",Free,Open Source,AI Coding Assistant,United States,"Mac, Windows, Linux, Self-Hosted, Visual Studio Code",English
SitesGPT,"AI-powered platform for quick SEO-optimized website creation, featuring instant content and image generation. Streamline web design for diverse needs like business sites, portfolios, and blogs effortlessly.",Freemium (Subscription),Proprietary,Website Builder,United States,Online,English
Web Check,"Get an insight into the inner-workings of a given website: uncover potential attack vectors, analyse server architecture, view security configurations, and learn what technologies a site is using.",Free,Open Source ( MIT ),Website Audit Tool,United Kingdom,"Online, Self-Hosted",English
Aura,"Aura is a sophisticated Amazon repricing tool that uses Artificial Intelligence to automatically adjust product prices. It analyzes the market and determines the optimal pricing strategy for each product listing, freeing you from manual adjustments.",Subscription,Proprietary,N/A,United States,Online,English
CachyOS,"CachyOS is designed to deliver lightning-fast speeds and stability, ensuring a smooth and enjoyable computing experience every time you use it. Whether you're a seasoned Linux user or just starting out, CachyOS is the ideal choice for those looking for a powerful...",Free,Open Source,"Linux Distro, Operating System","Germany, EU",Linux,English
OldNews,Access a treasure trove of historical newspapers. Search millions of pages from thousands of historical newspaper titles.,Paid,Proprietary,"Web Archiving Service, Genealogy Tool",Israel,Online,English
Struct,"Real-time chat platform structured with threads, custom feeds, project tagging, and AI moderation. Provides privacy controls, instant file and code sharing, multiple viewing modes, moderator tools, light/dark modes, and unifies collaboration for organizations and communities.",Subscription,Proprietary,"Team Collaboration Tool, Instant Messenger",United States,"Mac, Windows, Linux, Slack",English
MyPlace.app,"Enables businesses to convert WiFi networks into marketing tools by capturing customer data, syncing with marketing apps like Salesforce and Mailchimp, offering branded captive portals for internet access, connecting with review sites, and streamlining workflows. MobileApps & Add-Ons",Subscription,Proprietary,Wi-Fi Hotspot,"Ireland, EU",Online,English
OfflineLLM,"OfflineLLM is unlimited, private, offline, 24/7, free access to AI. Augment your day-to-day life by using this Ai chatbot for a multiplicity of applications. Freeonline tools",Pay once,Proprietary,"AI Chatbot, Large Language Model (LLM) Tool",N/A,visionOS,English
Video Compression,"Compress Videos for Free. Forever. Say goodbye to bulky files! Crush video sizes by 90% with no quality loss, even offline. And the best part? It's free!. Freeonline tools",Free,Open Source ( MIT ),Video Converter,International,Online,English
Evo,"The last productivity app you'll ever need, combining events, reminders, mood tracker, notes & diary, habits, a focus timer, and more. MobileApps & Add-Ons",Pay once,Proprietary,"Journaling App, Todo List Manager",N/A,"Mac, iPhone, iPad",English
BreezeDoc,"Upload contracts and agreements for digital e-signing, mark where signatures or data are needed, choose single or multiple signers, use prebuilt or custom templates, send reminders, track activity logs, and receive completed documents automatically for efficient workflows.",Freemium (Pay once),Proprietary,E-signature Tool,United Kingdom,Online,English
RecurseChat,"RecurseChat is a personal AI app for chatting with local AI offline and privately. Chat with images, import ChatGPT history, perform advanced text search, and much more. Software",Pay once,Proprietary,AI Writing Tool,N/A,Mac,"English, Afrikaans, Amharic, Arabic, Bengali, Bulgarian, Catalan; Valencian, Chinese, Croatian, Czech, Danish, Dutch, Estonian, Finnish, French, German, Greek, Gujarati, Hebrew, Hindi, Hungarian, Indonesian, Italian, Japanese, Kannada, Korean, Lithuanian, Latvian, Malay, Malayalam, Marathi, Norwegian Bokmål, Persian, Polish, Portuguese, Romanian, Russian, Serbian, Slovak, Slovene, Spanish, Swahili, Swedish, Tamil, Telugu, Thai, Turkish, Ukrainian, Urdu, Vietnamese, ▾"
Layout Land,Dive into Layout Land to learn key concepts that Will help you get started on your Webflow journey.,Free,Proprietary,N/A,United States,"Online, Webflow",English
Mistral Vibe,"Conversational tool providing access to advanced AI models with real-time adjustable moderation, high performance, flexible multi-platform deployment, support for customization, privacy-focused controls, and educational features for interactive learning experiences. MachineLearning & Artificial Intelligence",Freemium (Subscription),Proprietary,"AI Chatbot, Large Language Model (LLM) Tool","France, EU","Online, Android, iPhone, Android Tablet, iPad, Software as a Service (SaaS)","English, Dutch, French, German, Italian, Polish, Portuguese, Spanish"
ScreenshotMagic,"AI-driven Mac application automatically batch-renames screenshots and images, streamlining organization with customizable naming, reducing clutter, and simplifying file management, making it easier to retrieve, sort, and handle large image libraries efficiently.",Free,Proprietary,File Renamer,"Sweden, EU",Mac,English
Layers,"Layers is a design community platform built by designers for designers. Share your work, connect with other designers and build your portfolio.",Free,Proprietary,"UI Design Tool, Graphic Design Tool",United States,Online,English
Twodos,"Twodos is a privacy-focused task management app featuring two main lists, ""Sooner"" and ""Later"", for effective task prioritization. Tasks are automatically added to the ""Sooner"" list and can be moved to the ""Later"" list as needed. MobileApps & Add-Ons",Free,Proprietary,"Todo List Manager, Task Management Tool",International,iPhone,English
Supermaven,Supermaven is a coding assistant that uses AI to help you write code faster. Breeze through code refactoring with Supermaven's fast and accurate suggestions.,Freemium (Subscription),Proprietary,AI Coding Assistant,United States,"Mac, Windows, Linux, Visual Studio Code, Neovim",English
AFFiNE,"Open-source, privacy-focused workspace combining note-taking, project and task management, Kanban board, interactive whiteboard, Pomodoro timer, Markdown support, offline access, real-time team collaboration with @mentions, goal tracking, subtasks, and customizable features. OpenSource",Freemium (Subscription),Proprietary,"Note-taking Tool, Todo List Manager",Singapore,"Mac, Windows, Linux, Online, Android, iPhone, Self-Hosted",English
WriteText.ai,"Enhance content creation with AI automation for product text, meta titles, and category insights, optimizing SEO for WooCommerce. Offers keyword strategies, multi-language support, and API integration with e-commerce systems. Includes features like Open Graph, image alt text, and unlimited site support.",Freemium (Pay once or Subscription),Proprietary,"SEO Tool, AI Writing Tool",Philippines,"Online, Shopify, Software as a Service (SaaS), Wordpress, Magento / Adobe Commerce, WooCommerce","English, Danish, Swedish, Norwegian, German, French, Portuguese, Spanish, Catalan; Valencian, Dutch, Italian, Croatian, Czech, Estonian, Finnish, Hungarian, Indonesian, Latvian, Lithuanian, Malay, Polish, Romanian, Slovak, Swahili, Tagalog, Turkish, Uzbek, Vietnamese, Slovene, Norwegian Bokmål, ▾"
Procaptcha,Prosopo Procaptcha redefines user verification with a unique approach that emphasizes privacy and security. It's a pioneering solution designed to offer an alternative to conventional CAPTCHA systems that often compromise user privacy. Technews updates,Freemium (Subscription),Open Source ( Apache-2.0 ),Anti-Spam Tool,United Kingdom,"Online, Software as a Service (SaaS), Wordpress",English
Snaptick,"Snaptick is a user-friendly app designed to boost your productivity by helping you organize and achieve your daily plans effortlessly. With a clean and easy-to-use interface, this app offers essential features like task creation and editing, task prioritization, a built-in... Mobileapp discovery",Free,Open Source ( GPL-3.0 ),"Todo List Manager, Task Management Tool",N/A,"Android, Android Tablet, F-Droid",English
Shiori Android Client,"Shiori is an innovative bookmark management application that revolutionizes the way users save, organize, and access their favorite web pages. Built upon the robust Shiori platform, Shiori offers a seamless experience across all devices. Software",Free,Open Source ( Apache-2.0 ),"Bookmark Manager, Read It Later Tool","Spain, EU",Android  ,English
Nvidia App,"The NVIDIA app updates your PC with the latest drivers and technology, optimizes games and applications through a unified GPU control center, provides recording tools via in-game overlay, and highlights the latest NVIDIA tools and software. Mobileapp discovery",Free,Proprietary,"Screen Recorder, Screenshot Capture Tool",United States,Windows,English
ScreenTime+,ScreenTime+ is an automatic time tracking app for mac. It helps you to see where you're spending your time on Mac via the menu bar.,Pay once,Proprietary,"Time Tracking Tool, Anti Procrastination Tool",United States,Mac,English
Google Gemma,"A family of lightweight, state-of-the art open models built from the same research and technology that we used to create the Gemini models.",Free Personal,Open Source ( Apache-2.0 ),"AI Chatbot, Large Language Model (LLM) Tool",United States,Windows,English
Findr,AI-powered search that works across apps. Get instant answers to all questions with references to your app sources. Mobileapp discovery,Freemium (Subscription),Proprietary,N/A,United States,"Online, Software as a Service (SaaS)",English
Apple Sports,"Your real-time scores and stats app, fast and simple.",Free,Proprietary,Live Score App,United States,iPhone,"English, French, Spanish"
GodSVG,"Interactive vector editor built with Godot for creating or editing SVG files, featuring UI-based element manipulation, live code updates, direct markup access, no added metadata, minimal abstraction, clean output, and intended use on desktop plus mobile devices.",Free,Open Source ( MIT ),Vector Graphic App,N/A,"Mac  , Windows, Linux, Online  , Android",English
Fossify Voice Recorder,Introducing Fossify Voice Recorder – where capturing crystal-clear audio and preserving precious moments is effortless and enjoyable. Seamlessly blend simplicity with functionality as you embark on a journey of seamless recording experiences tailored to your needs.,Free,Open Source ( GPL-3.0 ),Audio Recorder,India,"Android, F-Droid, Android Tablet",English
TidyCal,"Web-based scheduling platform offering unlimited meeting booking types, seamless calendar, video conferencing, and payment integrations, cross-timezone support, easy setup, embeddable booking pages, API automations, mobile-friendly interface, and notifications.",Freemium (Pay once),Proprietary,Appointment Scheduler,United Kingdom,"Online, Software as a Service (SaaS)",English
Quillow,Say good-bye to boring link-in-bios. Build a micro-site that can do everything and more.,Free,Proprietary,Website Builder,United Kingdom,Online  ,English
Open WebUI,"Feature-rich offline AI platform with support for Ollama and OpenAI-compatible APIs, retrieval-augmented generation, text-to-image, cloud sync, privacy focus, ad-free experience, distraction-free and dark modes, no registration, easy deployment, and customizable UI.",Free,Open Source,"AI Chatbot, Large Language Model (LLM) Tool",United States,"Online, Self-Hosted, Cloudron, Docker","English, Arabic, Bengali, Bulgarian, Catalan; Valencian, German, Basque, Danish, Spanish, Persian, Finnish, French, Greek, Hebrew, Hindi, Croatian, Hungarian, Indonesian, Irish, Italian, Japanese, Georgian, Korean, Lithuanian, Malay, Norwegian Bokmål, Dutch, Panjabi, Punjabi, Polish, Portuguese, Romanian, Russian, Slovak, Swedish, Serbian, Thai, Turkmen, Ukrainian, Urdu, Vietnamese, Chinese, ▾"
Bulletin AI News,"Bulletin is a beautiful RSS news reader app built with macOS design guidelines in mind, and supercharged with powerful AI capabilities.",Freemium (Pay once or Subscription),Proprietary,"RSS Reader, News Reader",United Kingdom,"Mac, iPhone, iPad, Apple Watch, visionOS",English
Astropad Slate,Control your Mac using your iPad and Apple Pencil.,Pay once,Proprietary,N/A,United States,"Mac, iPad",English
Reor,"Reor is an AI-powered desktop note-taking app: it automatically links related ideas, answers questions on your notes and provides semantic search. Everything is stored locally and you can edit your notes with an Obsidian-like markdown editor. Applicationsoftware reviews",Free,Open Source ( AGPL-3.0 ),Note-taking Tool,International,"Windows, Mac, Linux",English
Day Peek,"Day Peek helps you stay on top of your schedule. It displays a clock with your upcoming events in a colorful, floating widget that gradually fades in as the event approaches.",Pay once,Proprietary,N/A,"Germany, EU",visionOS,English
HeliBoard,"HeliBoard is a fork of OpenBoard , continuing the project from where it stopped. SoftwareUtilities",Free,Open Source ( GPL-3.0 ),Mobile Keyboard,International,"Android, Android Tablet, F-Droid",English
Tabsets Tab Manager,Bookmarks next generation - Tabsets is a browser extension that helps you get your links really organized.,Free,Open Source ( MIT ),"Bookmark Manager, Tab Manager",N/A,"Microsoft Edge, Google Chrome, Mozilla Firefox",English
sNotes – Students Notes,"Students Notes is a note-taking app designed for online learners to overcome information overload,
organization, and memorization challenges.",Free,Proprietary,Note-taking Tool,N/A,Online,English
Fossify Music Player,Introducing Fossify Music Player – your gateway to uninterrupted musical enjoyment. Say goodbye to intrusive ads and hello to a seamless music experience designed to accompany you wherever you go.,Free,Open Source ( GPL-3.0 ),"Audio Player, Media Player",India,"Android, F-Droid, Android Tablet",English
Superlist,"AI productivity platform for teams consolidates tasks, notes, meeting transcription, and instant task assignments into one workspace. Integrates with existing tools to streamline workflows, eliminate administrative work, and improve team coordination and efficiency.",Freemium (Subscription),Proprietary,"Todo List Manager, Task Management Tool","Germany, EU","Mac, Online, Android, iPhone, iPad","English, German"
CueCam Presenter,"CueCam Presenter is a Mac app that lets you share anything on your webcam. Use your iPhone as a camera, teleprompter and preview window. Use your iPad to draw on anything. MobileApps & Add-Ons",Subscription,Proprietary,N/A,United Kingdom,Mac,English
Meet Sponsors,"Streamline the process for YouTubers to find sponsors quickly, eliminating unmonetized videos by facilitating proactive sponsorship searches and improving income potential through matches that align with their audience and interests.",Subscription,Proprietary,N/A,"France, EU","Online, Software as a Service (SaaS)",English
Infomaniak kSync,Infomaniak Sync enables you to synchronise your contacts and calendars between Infomaniak's WorkSpace and your Android devices. AndroidOS,Free,Open Source ( GPL-3.0 ),N/A,Switzerland,"Android, Android Tablet, F-Droid",English
Better Reader,I love Omnivore! Let me make that very clear upfront. Nevertheless I've had a couple of issues with the default app. Especially performance wise. This app hopes to solve those issues. Applicationsoftware reviews,Free,Proprietary,"Bookmark Manager, Read It Later Tool",N/A,iPhone,"English, German"
Compresto,Experience up to 90% file size reduction for videos and images while working entirely offline to ensure privacy. Supports conversion to GIF and is compatible with formats like MP4 and WebM. Enhances productivity by allowing batch processing and provides multiple quality options.,Pay once or Subscription,Proprietary,Video Converter,Singapore,Mac,English
Sweep,Sweep is an AI junior developer that turns bugs and feature requests into code changes. Sweep automatically handles devex improvements like adding typehints/improving test coverage. 🤖,Freemium (Subscription),Open Source,AI Coding Assistant,United States,"GitHub, Self-Hosted, Software as a Service (SaaS)",English
Rapidforms,"Create shareable and embeddable online forms like newsletter, waitlist, and contacts that look great with no effort or coding skills.",Pay once,Proprietary,Form Builder,N/A,Online,English
Wondera,"Karaoke and transform any songs in your AI voice. No singing skill required, your AI voice can handle any song even in other languages!.",Free,Proprietary,AI Voice Generator,N/A,"Android, iPhone","English, Chinese"
AgentHub,AgentHub is a no-code platform for building powerful AI automations. Our drag-and-drop visual builder lets users create reliable and cost-effective AI-powered automations. Fully automate tasks end-to-end without writing a line of code.,Freemium (Subscription),Proprietary,"Workflow Automation Tool, Task Automation App",United States,Software as a Service (SaaS),English
Geppetto,Advanced Slack bot integrating OpenAI's ChatGPT-4 and DALL-E-3 for interactive AI conversations and image generation.,Free,Open Source ( AGPL-3.0 ),"AI Chatbot, AI Writing Tool",International,"Self-Hosted, Slack",English
Spatial Symphony,"A groundbreaking music app designed exclusively for Apple Vision Pro. Immerse yourself in a spatial world where music and innovation converge, allowing you to create, manipulate, and explore sound in an entirely new dimension. Software",Freemium (Pay once),Proprietary,Music Production App,N/A,visionOS,English
neoSVG,Revolutionize your design process with neoSVG! Our AI-powered tool transforms simple text prompts into stunning SVG graphics.,Subscription,Proprietary,AI Image Generator,Brazil,Online,English
FormatLab,FormatLab is a Powerful Tool for Converting Video and Audio files and supports almost All Formats with modern and widely supported codecs.,Freemium (Pay once or Subscription),Proprietary ( MIT ),"Audio Converter, Video Converter",India,"Linux, Snapcraft, Flathub",English
Placemark,"The Placemark application. This is a web application that lets you import, create, export, visualize, and publish geospatial data. It supports many geospatial data formats, and many editing operations, both algorithmic, like buffering, and drawing-based.",Free,Open Source ( MIT ),N/A,N/A,"Self-Hosted, Docker, Online",English
YDB,YDB is an open source Distributed SQL Database that combines high availability and scalability with strong consistency and ACID transactions.,Free,Open Source ( Apache-2.0 ),Relational Database,Russia,"Self-Hosted, Docker",English
Domain Digger,Full Open-Source Toolkit for Next-Level Domain Analysis.,Free,Open Source ( AGPL-3.0 ),N/A,"Germany, EU",Online,English
FiveTaco,Marketing tools listing platform for businesses. Discover top software for solopreneurs. Level up your business with cutting-edge tools from our curated directory!.,Free,Proprietary,App Discovery Service,N/A,Online,English
BeatInspector,"BeatInspector is meant to help music producers analyze other tracks for remixing, referencing etc. by displaying relevant data about them, namely their BPM, key, genre, time signature, and average loudness.",Free,Open Source ( GPL-3.0 ),N/A,International,"Android, F-Droid, Android Tablet",English
LINA: Art therapy & Journaling,"LINA is a Virtual Art Therapist using cognitive-behavioral therapy (CBT) techniques to provide mental health support and art journal activities. It aims to boost confidence, improve self-esteem, heal past trauma, relieve anxiety, and promote personal growth.",Freemium (Subscription),Proprietary,Journaling App,N/A,iPhone,English
Fixkey,Fixkey fixes your grammar in any app using AI. MobileApps & Add-Ons,Subscription,Proprietary,"Grammar Checker, AI Writing Tool",N/A,Mac,English
Wren Task Manager,"A note-taking application and a to-do management system that is ridiculously simple, yet very advanced.",Free,Open Source ( MIT ),"Todo List Manager, Task Management Tool",N/A,"Windows, Mac, Linux, Python",English
Seabird,"Seabird is a native cross-platform Kubernetes desktop client that makes it super easy to explore your cluster's resources. We aim to visualize all common resource types in a simple, bloat-free user interface.",Free,Open Source ( MPL-2.0 ),N/A,United States,"Linux, Mac, Windows, Flathub",English
Bitspace,"Bitspace is a platform which offers a wide canvas & building blocks for your creative endevours. Build experiments & ideas with Artificial Intelligence, WebGL Shaders, Color manipulations, Animations or whatever floats your boat.",Free,Open Source ( MIT ),N/A,N/A,Online,English
Arcush,"Arcush is a minimalistic daily planner app that can help you build a balanced schedule, plan smarter, and get more productive. Applicationsoftware reviews",Freemium,Proprietary,"Todo List Manager, Task Management Tool",United States,iPhone,"English, Chinese, Dutch, French, German, Italian, Japanese, Polish, Portuguese, Spanish, Ukrainian"
Couch,"Discover Couch: Your Read-It-Later Companion for Pocket and/or iCloud
Elevate your reading experience with Couch.",Freemium (Pay once),Proprietary,"Bookmark Manager, Read It Later Tool",N/A,"Mac, iPhone, iPad","English, German"
CapGo.AI,"CapGo.AI is an AI-driven spreadsheet that extracts data from various sources like the internet, databases, and PDFs for market analysis and lead enrichment. The spreadsheet compiles data from over 10 sources such as Apollo, Hunter.io, and LinkedIn.",Freemium (Subscription),Proprietary,Spreadsheet App,N/A,"Online, Software as a Service (SaaS)",English
Folksable,"Folksable is a productivity app that is designed to help you achieve your goals with social accountability. With Folksable, you can make social contracts with your friends and track your habits together by photo check-in and maintaining streaks with friends for accountability...",Free,Proprietary,Habit Tracker,N/A,"Android, iPhone, iPad",English
Spliit,Spliit is a minimalist application to track and share expenses with your friends and family. Software,Free,Open Source ( MIT ),"Budget Manager, Personal Finance Tool",Canada,"Online, iPhone",English
FeedCord,"FeedCord is a dead-simple RSS Reader designed to integrate seamlessly with Discord. With just a few configuration steps, you can have a news feed text channel up and running in your server.",Free,Open Source ( MIT ),"RSS Reader, News Reader",N/A,"Self-Hosted, Docker",English
Papermark,Papermark is an open-source document sharing alternative to DocSend with built-in analytics and data rooms feature. Built with Vercel Storage and Vercel Edge Functions. OpenSource,Freemium (Subscription),Open Source,N/A,N/A,"Self-Hosted, Software as a Service (SaaS)",English
Boardzilla,Boardzilla is a place for playing and developing board games all within your browser. Boardzilla makes it easy to express the game rules and provides players with a simple interface to the choices available to them. WebBrowsers,Free,Open Source ( AGPL-3.0 ),Board Game,United States,Online,English
