title,description,cost,license,app_type,origin,platform,supported_languages
SleepRecovery,"Introducing ""SleepRecovery"" - the app that helps you track and measure your body's recovery during sleep using heart rate, respiratory rate, and body temperature (on compatible Apple Watches).",Pay once,Proprietary,N/A,"Germany, EU","iPhone, iPad, Apple Watch","English, Chinese, French, German, Italian, Spanish"
Game Widgets: Discover games,"Don't miss any new games! Discover new games for PC, consoles, and more thanks to the power of the IGDB database.",Freemium,Proprietary,N/A,N/A,"iPhone, iPad","English, French, German, Spanish"
Harmony Music,"Ad-free streaming client for Android, Windows, and Linux sourcing music from YouTube and YouTube Music, supporting offline play, playlist importing, song caching, lyrics, equalizer, quality control, dynamic themes, radio mode, artist bookmarks, and multi-language interface.",Free,Open Source ( GPL-3.0 ),"Audio Player, Music Streaming Service",International,"Windows  , Linux  , Android, F-Droid","English, Bulgarian, Czech, French, German, Hindi, Indonesian, Japanese, Norwegian Bokmål, Polish, Panjabi, Punjabi, Russian, Serbian, Spanish, Turkish"
NextDNS Manager,"With this management app, you can manage and change your NextDNS settings, check your connection, test your ping, and see other connection information!",Free,Open Source ( GPL-3.0 ),N/A,United States,"Android, Android Tablet",English
Remitly,"Securely send money globally to banks and cash pickup spots with competitive exchange rates and no recipient fees. Enjoy 24/7 service, real-time updates, and a refund policy for delayed transfers.",Paid,Proprietary,Money Transfer Service,United States,"Online, Android, iPhone, Android Tablet, iPad","English, Chinese, Dutch, French, German, Italian, Korean, Polish, Portuguese, Romanian, Russian, Spanish, Thai, Turkish, Vietnamese"
NotebookLM,"AI-first notebook by Google, available in the U.S., blends large language models and user-chosen data. Apply for access to explore intelligent insights and enhance your note-taking experience.",Free,Proprietary,Note-taking Tool,United States,"Online, Android, Android Tablet, iPhone, iPad","English, Afrikaans, Albanian, Amharic, Arabic, Armenian, Azerbaijani, Basque, Belarusian, Bengali, Bulgarian, Burmese, Khmer, Catalan; Valencian, Croatian, Czech, Danish, Dutch, Estonian, Finnish, French, Galician, Georgian, German, Greek, Gujarati, Hebrew, Hindi, Hungarian, Icelandic, Indonesian, Italian, Japanese, Kannada, Kazakh, Korean, Kirghiz, Kyrgyz, Lao, Latvian, Lithuanian, Macedonian, Malay, Malayalam, Marathi, Mongolian, Nepali, Norwegian Bokmål, Persian, Polish, Portuguese, Panjabi, Punjabi, Romanian, Russian, Serbian, Chinese, Sinhala, Sinhalese, Slovak, Slovene, Spanish, Swahili, Swedish, Tamil, Telugu, Thai, Turkish, Ukrainian, Urdu, Vietnamese, Zulu, ▾"
Respawn,"Respawn is a modern habit tracker / productivity suite featuring coaching, accountability, gamification, alarms, journaling and integrations with your device.",Freemium (Subscription),Proprietary,Habit Tracker,United States,"Android, iPhone  , iPad, Android Tablet",English
Infinite Mac,"Infinite Mac is a collection of classic Macintosh system releases and software, all easily accessible from the comfort of a (modern) web browser. MacOS",Free,Open Source ( Apache-2.0 ),N/A,"Romania, EU",Online,English
Lookyloo,Lookyloo is a web interface that allows users to capture a website page and then display a tree of domains that call each other.,Free,Open Source,Web Scraping Tool,Switzerland,"Windows, Linux, Online",English
YouChoose.AI,Gain control back on your recommendations on YouTube.,Free,Open Source ( AGPL-3.0 ),N/A,N/A,"Google Chrome, Firefox",English
Geddit,"Geddit is an open-source, Reddit client for Android without using their API.",Free,Open Source ( GPL-3.0 ),Reddit Client,N/A,Android,English
Meetor,"Meetor is the Effortless and Secure When2Meet Alternative - Simplify scheduling without the need for sign-ups, with our free and user-friendly interface.",Free,Proprietary,Appointment Scheduler,N/A,Online,"English, Chinese"
Kahana,"Kahana can be thought of as Patreon meets Google Drive. It's a collaborative platform that lets you create hubs of knowledge with other creators & experts and monetize together. You can upload your best knowledge (information you've learned, notes, methodologies...",Freemium (Subscription),Proprietary,N/A,N/A,"Software as a Service (SaaS), Online",English
LD Photo Editor,A layer-based photo editor for creating cinematic imagery.,Freemium (Subscription),Proprietary,"Image Editor, Photo Editor",United States,"Android, iPhone, iPad, Android Tablet",English
Peak: Fitness Widgets,"Peak lets you make your own fitness dashboard, and always stay on top of it with a range of widgets.",Freemium (Subscription),Proprietary,Fitness Tracker,N/A,iPhone,"German, Spanish"
Workout.lol,Workout.lol is a free and open-source platform designed to help you achieve your fitness goals. I used the exercises and videos from the awesome MuscleWiki website (with their consent).,Free,Open Source ( MIT ),N/A,United States,Online,English
Whisper Mate,"Batch transcribe audio files or movie files into text with OpenAI's Whisper AI Model. With an embed subtitles editor to preview the transcription result segment by segment.
All transcribe operation is processing in local machine. Keep your privacy safe.",Freemium (Pay once),Proprietary,N/A,N/A,Mac,"English, Chinese, Japanese"
Pokémon Sleep,"Do you find yourself struggling to get energized in the morning? Has the same old bedtime routine grown tiresome? Now, you can turn your sleep into entertainment with Pokémon Sleep! Playing this game is simple: just place your smartphone by your pillow, then go to sleep.",Freemium (Pay once or Subscription),Proprietary,N/A,Japan,"Android, iPhone","English, French, German, Italian, Japanese, Korean, Chinese, Spanish"
Reword,"Write articles that perform with an editor that thinks. Reword helps your team collaborate ethically with AI, so that you can write outstanding articles for your readers.",Subscription,Proprietary,AI Writing Tool,Australia,Online,English
SaveDesktop,"Save and load KDE Plasma, Xfce and GNOME-based DE configuration.",Free,Open Source ( GPL-3.0 ),N/A,N/A,"Linux, Flathub, Flatpak, Linux Mobile",English
Memo AI,"Whether it's YouTube, Podcast or local audio and video files, convert text and concentrate the essence.",Freemium (Pay once),Proprietary,"Audio Transcription Tool, Video Transcription Tool",N/A,"Windows, Mac",English
ruff: a writing companion,ruff is your pocket-sized best friend that aims to make writing on the go fun and sharing it fast & easy. It's a single sheet of text with your progress automatically saved and restored between sessions.,Freemium (Pay once),Proprietary,Note-taking Tool,N/A,"Windows, Android",English
Kamua,"Kamua is a web-based video editing tool that uses AI to automate tasks like cutting, resizing, and captioning videos. It can generate captions and subtitles in over 60 languages, and optimizes subtitles for portrait mode.",Paid,Proprietary,"Video Editor, AI Video Generator",N/A,Online,English
Anchorpoint,"Anchorpoint is based on Git and extends it with file locking, better large file support and a simple UI for non coders. It is compatible to all Git hosting providers such as GitHub, GitLab Azure DevOps etc. and usually used in Unreal or Unity Engine projects.",Subscription,Proprietary,Version Control System,N/A,"Windows, Mac",English
Tella,"Tella is a mobile app designed to protect human rights defenders, advocates, and journalists by encrypting and hiding their sensitive data and safely uploading it to their organization's server.",Free,Open Source,Disk Encryption Tool,N/A,"iPhone, Android, F-Droid","English, Arabic, Belarusian, Burmese, French, Persian, Spanish, Tamil"
Digest,"Digest aggregates content from various online sources to create personalized daily email newsletters. Create a personalized digest of your favorite content from sources like Weather, Reddit, Hacker News, YouTube, Product Hunt, RSS, Instagram, TikTok, Stripe, Google Calendar, and...",Subscription,Proprietary,N/A,N/A,"Online, Software as a Service (SaaS)",English
Voidpet Garden,"Voidpet Garden is a mental health app that uses a virtual pet care simulation to promote self-care. Users interact with creatures in their consciousness garden, carrying out mindfulness exercises and therapy prompts.",Freemium,Proprietary,Habit Tracker,United States,"iPhone, iPad, Android, Online, Discord",English
Khoj,"Open-source app offers local or cloud AI chat with major LLMs, advanced semantic search, automation, personal newsletters, document indexing, image generation, and text-to-speech. Access from web, Obsidian, Emacs, desktop, mobile, or messaging platforms.",Free,Open Source ( AGPL-3.0 ),"AI Chatbot, Large Language Model (LLM) Tool",India,"Mac, Windows, Linux, Self-Hosted, Python, Homebrew, Docker",English
Biscuits.ai,Generate cookie policies by scanning your website with AI.,Freemium (Pay once),Proprietary,N/A,N/A,Online,English
Atua,"Atua is an easy-to-use application that allows instant access to ChatGPT on any Mac app with the use of a shortcut key. It helps users maximize the benefits of ChatGPT, from content creation to code modification, with minimal context switching.",Pay once,Proprietary,N/A,N/A,Mac,English
DivMagic,Copy design from any website.,Subscription,Proprietary,N/A,N/A,"Google Chrome, Firefox",English
OpenChat,"OpenChat is an everyday user chatbot console that simplifies the utilization of large language models. With the advancements in AI, the installation and usage of these models have become overwhelming. OpenChat aims to address this challenge by providing a two-step setup process...",Subscription,Open Source ( MIT ),N/A,N/A,"Mac, Windows, Linux, Software as a Service (SaaS)",English
Kament,"Kament intelligently detects whether the comment section for a Youtube video is disabled, if so the extension activates itself and injects a comment section in place of the original Youtube's comment box.",Free,Proprietary,N/A,N/A,"Google Chrome, Firefox",English
PlainApp,"🔥 PlainApp is an open-source application that allows you to manage your phone through a web browser. Access files, videos, music, contacts, sms, calls, and more from your desktop using a secure, easy to use web interface!.",Free,Open Source ( AGPL-3.0 ),N/A,N/A,"Online, Android, F-Droid",English
Pixelicious,"Pixelicious is an online tool designed to transform images into pixel art, a process that can be particularly useful for game development. This image-to-pixel art converter allows users to take any image and convert it into pixelated form, making it suitable for use in various...",Free,Proprietary,N/A,N/A,Online,English
PageVitals,"Super easy website performance monitoring for teams that want to have a faster, better ranking website. Get notified if your website gets slow. Most affordable Lighthouse, CrUX and RUM tool.",Subscription,Proprietary,N/A,"Denmark, EU",Online,English
Bespoke,"The open source personalized marketing platform. Bespoke's mission is to gather information about the customer and do personalized targetting. We gather customer data through various means, including API's, behavioral intent, surveys and integrations with platforms for...",Freemium (Subscription),Open Source ( AGPL-3.0 ),Email Marketing Service,United States,"Self-Hosted  , Software as a Service (SaaS)  ",English
Thumb-Key,"Thumb-Key is a privacy-conscious smart keyboard, made specifically for your thumbs.",Free,Open Source ( AGPL-3.0 ),Mobile Keyboard,International,"Android, F-Droid",English
Screen Time for Android,Displays your screen time in a permanent notification.,Free,Open Source ( Unlicense ),Time Tracking Tool,"Germany, EU","Android, F-Droid",English
Toshy,"Toshy is a config file for the keyszer Python-based keymapper for Linux (which was forked from xkeysnail). The Toshy config is not strictly a fork of Kinto, but was based in the beginning entirely on the config file for Kinto.sh by Ben Reaves (https://github.",Free,Open Source ( GPL-3.0 ),Key Mapping Tool,N/A,Linux,English
Autodesk Flow Studio,"Cloud toolset uses AI to animate, light, and compose CG into live-action footage from any single camera, generates 3D models from text or images, offers mocap without suits, video-to-3D-scene, full edit controls, and integration with popular 3D software.",Freemium (Subscription),Proprietary,AI Video Generator,United States,Online,English
Scenario,"Create style-consistent game assets with AI-driven workflows. Scenario enables rapid model training, quick iteration, and seamless integration into art pipelines. It offers advanced editing tools and ensures enterprise-grade security for content production. Ideal for customizing AI generators.",Freemium (Subscription),Proprietary,AI Image Generator,United States,"Online, Self-Hosted, Discord, Unity, Software as a Service (SaaS)","English, French"
FastLyrics,"FastLyrics is an app that downloads lyrics for the song, you're listening to.",Free,Open Source ( GPL-3.0 ),Lyrics Displayer,N/A,"Android, F-Droid",English
REAL Video Enhancer,"Cross-platform tool offering advanced video upscaling and frame interpolation using RIFE, RealESRGAN, Waifu2x, and IFRNET, with scene change detection, instant preview, Discord integration, and ability to enhance local files or YouTube videos on major operating systems.",Free,Open Source ( AGPL-3.0 ),"Image Upscaling App, Video Upscaling App",United States,"Mac, Windows, Linux, Flathub",English
WorkOutDoors,"WorkOutDoors is the ultimate workout app for Apple Watch, offering fully functional vector maps and a wide range of advanced features such as periodic alerts, configurable metrics, automatic laps, interval schedules, and connection to Bluetooth sensors.",Pay once,Proprietary,Run Tracker,United Kingdom,"iPhone, Apple Watch",English
CounterSocial,A unique social network. No trolls. No abuse. No ads. No fake-news. No foreign influence operations.,Free,Proprietary,"Social Network, Microblog",United States,"iPhone, iPad, Android, Online",English
Fortune,"Manage finances with Fortune App, providing real-time insights into key performance indicators like revenue, expenses, cash flow, and account balances. Fortune integrates with over 17,000 banks, enabling a consolidated view of financials.",Freemium (Subscription),Proprietary,Personal Finance Tool,United States,"Android, iPhone",English
Autopod,"Automatic editing plugin pack for Adobe Premiere Pro streamlining video podcast workflows, with multi-camera editing for up to 10 angles, customizable presets, social clip generator in multiple aspect ratios, jump cut detection, and batch exporting of clips.",Subscription,Proprietary,Video Editor,N/A,"Mac, Windows, Adobe Premiere Pro",English
Blox: Financial Planning,"Supercharge your financial planning and modelling. Craft powerful financial models, automate data updates, collaborate and plan seamlessly and reclaim hundreds of lost hours spent on tedious tasks.",Freemium (Subscription),Proprietary,Personal Finance Tool,United States,Online,English
Claude,"Claude is a next-generation AI assistant based on Anthropic’s research into training helpful, honest, and harmless AI systems. Accessible through chat interface and API in our developer console, Claude is capable of a wide variety of conversational and text processing tasks...",Freemium (Subscription),Proprietary,"AI Chatbot, Large Language Model (LLM) Tool",United States,"Mac, Windows, Online, Android, iPhone, iPad, Software as a Service (SaaS), Google Sheets","English, French, German, Hindi, Indonesian, Italian, Japanese, Korean, Portuguese, Spanish"
Threads,Say more with Threads — Instagram’s text-based conversation app.,Free,Proprietary,"Social Network, Microblog",United States,"Online, Android, iPhone","English, Croatian, Czech, Danish, Dutch, Finnish, French, German, Greek, Hindi, Hungarian, Indonesian, Italian, Japanese, Korean, Malay, Norwegian Bokmål, Polish, Portuguese, Romanian, Russian, Chinese, Slovak, Spanish, Swedish, Tagalog, Thai, Turkish, Ukrainian, Vietnamese, ▾"
ShowScriber,Automatically transcribe your podcast audio to text and generate show notes and chapter lists using state-of-the-art AI and machine learning that makes a previously lengthy process a thing of the past.,Pay once,Proprietary,Audio Transcription Tool,N/A,Online,English
Flamingo: Chat with AI,"Flamingo is a revolutionary AI chatbot that lets you chat with a smart and friendly companion anytime, anywhere. Flamingo is not just a regular chatbot, it's a personal assistant that can help you with various tasks and topics.",Freemium (Subscription),Proprietary,AI Chatbot,Pakistan,Android,English
Memori Notes,"Experience the power of Memori Notes, the ultimate companion for content collectors and thought enthusiasts.",Pay once,Proprietary,Note-taking Tool,N/A,"Android, iPhone",English
TapScroll,"TapScroll makes it easy to scroll to upper of the page, with just one simple tap.",Free,Proprietary,N/A,N/A,"Android, Android Tablet",English
PromptChainer,"PromptChainer is a visual flow builder tool that enables users to create complex AI-driven flows with ease. It allows for the seamless integration of AI and traditional programming, chaining of prompts and models, and the management of AI-generated insights on large-scale data.",Freemium,Proprietary,N/A,N/A,Online,English
Flashy.io,"Are you tired of spending hours creating language flashcards for Anki? Do you wish there was an easier way to generate useful cards about the language topics you care about? Look no further than Flashly, the app that uses AI to generate Anki language flashcards for you!",Free,Proprietary,"Flashcard Learning Tool, Language Learning Tool",United States,Online,English
Podbay,"Podbay is a podcast player made by an independent company.




The Podbay app is a modern podcast player, with all the features you need for a great podcast listening experience.




It syncs seamlessly with your Podbay.fm account. You can start an episode on your desktop and then fini.",Free,Proprietary,"Podcast Player, Podcast Manager",N/A,"Online, iPhone, Android",English
TwoSlash,"Simply type ""//ai"" anywhere you can enter text on the web, and watch as your ideas transform into reality. TwoSlash empowers you to generate content, improve grammar, translate languages, write and fix code, and much more—all with the speed and precision of ChatGPT AI.",Pay once or Subscription,Proprietary,AI Writing Tool,N/A,Google Chrome,English
Liftoff for Lemmy,Liftoff aims to provide a seamless experience when browsing different Lemmy instances.,Free,Open Source ( GPL-2.0 ),Lemmy Client,N/A,"Windows, Linux, Android, iPhone",English
Boost for Lemmy,Boost for Lemmy is designed to provide a seamless browsing experience for the decentralized social platform Lemmy and the Fediverse.,Freemium,Proprietary,Lemmy Client,United Kingdom,"Android, Android Tablet",English
AudioPen,"Transforms voice into neat, summarized text, eliminating fillers. Features advanced paid options like writing style customization, length control, and note export for enhanced journaling and content creation.",Subscription,Proprietary,"Audio Transcription Tool, Note-taking Tool",United States,"Online, Google Chrome, Android, iPhone",English
LinkSpree,"LinkSpree turns your saved links into intelligent, visual dashboards that organize, activate, and keep you accountable to the resources that matter.",Freemium (Subscription),Proprietary,Bookmark Manager,N/A,Online,English
Connect for Lemmy,Connect for Lemmy is a native application for browsing the social platform Lemmy and the Fediverse. Applicationsoftware reviews,Free,Proprietary,Lemmy Client,N/A,Android,English
Summit for Lemmy,Summit for Lemmy enables you to explore hundreds of Lemmy communities with ease.,Free,Open Source ( AGPL-3.0 ),Lemmy Client,Canada,Android,English
Shitter,Lightweight Android app for Mastodon.,Free,Open Source ( GPL-3.0 ),Mastodon Client,N/A,"Android, Android Tablet, F-Droid",English
Voyager for Lemmy,"Voyager is an Apollo-like open source web client for Lemmy. It's a mobile-first app, but works great on desktop devices, too. Please feel free to try it out!",Free,Open Source ( AGPL-3.0 ),Lemmy Client,United States,"Online, Android, iPhone, Android Tablet, iPad, Apple Watch, F-Droid",English
Pixquare - Pixel Art Editor,"Pixquare is a powerful pixel art app for iPad. If you are looking for an app with a simple UI, easy workflow, and advanced features for pixel art creation, then Pixquare is a good choice for you!.",Freemium (Pay once),Proprietary,Color Picker Tool,N/A,"iPad, iPhone","English, Dutch, French, German, Indonesian, Italian, Japanese, Korean, Polish, Portuguese, Chinese, Spanish, Thai"
Bigcapital,"Bigcapital is a smart and open-source accounting and inventory software, Bigcapital keeps all business finances in right place and automates accounting processes to give the business powerful and intelligent financial statements and reports to help in making decisions.",Subscription,Open Source ( AGPL-3.0 ),"Budget Manager, Invoicing Software",United States,"Online, Self-Hosted, Software as a Service (SaaS)",English
Tapely.io,We make software to help YouTubers easily design YouTube thumbnails to save time and improve Click-Through-Rate. We have launched our early-stage version of the product and are looking for feedback.,Free,Proprietary,N/A,N/A,Online,English
Pycopaste,"Pycopaste, the ultimate clipboard manager for macOS, designed to enhance your productivity by streamlining your copying and pasting experience!.",Freemium,Proprietary,Clipboard Manager,N/A,"Mac, iPhone, iPad",English
Auslogics SSD Optimizer,"Drive maintenance utility designed for solid-state drives, minimizing write operations, supporting space management, providing health monitoring, disk cleanup, scheduling optimization, real-time status updates, file organization tools, and detailed usage reports.",Freemium (Pay once),Proprietary,N/A,Australia,Windows,English
Vscoped,Vscoped is an AI-powered transcription service that includes a built-in feature for adding hardcoded subtitles to video content.,Subscription,Proprietary,"Audio Transcription Tool, Video Transcription Tool",N/A,Online,English
Element X,"It is the brand new, and fastest ever, Matrix client. It is for personal and community use, and will support enterprise functionality later this year.",Free,Open Source ( AGPL-3.0 ),"Instant Messenger, Video Calling App",United Kingdom,"Android, iPhone, Android Tablet, iPad, Android Auto","English, Chinese, Czech, French, German, Italian, Romanian, Russian, Slovak, Spanish"
SmartGym,"SmartGym offers a personalized workout experience with an advanced algorithm, catering to weight loss, muscle building, and endurance goals. The app provides feedback, tips, and over 130 pre-made workouts, making it suitable for beginners and experienced users.",Freemium (Subscription),Proprietary,N/A,Brazil,"Mac, iPhone, iPad, Apple Watch","English, French, German, Italian, Portuguese, Spanish"
Lemonade for Lemmy,"Lemonade is a sleek and modern Lemmy client that is designed to provide a seamless browsing experience for Lemmy users. Built with the latest technology, Lemonade utilizes the power of libadwaita and GTK 4 to deliver a beautiful and intuitive user interface that is both easy to...",Free,Open Source ( GPL-3.0 ),Lemmy Client,N/A,"Linux, Flathub, Flatpak",English
TrguiNG,TrguiNG is an alternative UI for controlling transmission torrent daemon running on the same machine or any other host that has exposed transmission rpc endpoint.,Free,Open Source ( AGPL-3.0 ),N/A,N/A,"Linux, Flathub, Windows, Mac",English
BatFi,"Manage and extend the life of your Mac's battery with BatFi, a powerful yet simple battery management software designed exclusively for macOS. BatFi keeps a close eye on your battery's percentage and charging state, offering intelligent control to ensure optimal battery...",Pay once,Proprietary,"Battery Monitor, Battery Saver Utility",N/A,Mac,English
Ripple,"Convert vocal ideas into complete arrangements in multiple genres using a mobile studio with AI-driven accompaniment, detailed audio editing, BPM and effects, plus options for sharing music online, supporting both novice and experienced creators in music production.",Free,Proprietary,"AI Music Generator, Music Production App",China,"iPhone, iPad",English
gossip,"Gossip is a desktop client made in Rust for Nostr, an open social media protocol similar to Twitter except that you control your own account, and you can post to many different independent places called ""relays"".",Free,Open Source,Social Network,N/A,"Windows, Linux",English
Festival Music Player,Festival is a music player for local album collections.,Free,Open Source ( MIT ),"Audio Player, Media Player",N/A,"Linux, Windows, Mac",English
Background Removal in the Browser,Remove backgrounds from images directly in the browser environment with ease and no additional costs or privacy concerns.,Free,Open Source ( AGPL-3.0 ),N/A,"Germany, EU","Online, Self-Hosted",English
UXArchive,UXArchive is a comprehensive platform that offers users an extensive collection of mobile UX trends sourced from some of the most popular mobile apps worldwide.,Free,Proprietary,UI Design Tool,N/A,Online,English
