title,description,cost,license,app_type,origin,platform,supported_languages
Fretboard,"Fretboard lets you find guitar chords by typing their names or plotting them on an interactive guitar neck. When you have identified a chord, you can experiment with changing it, see more ways to play it, or bookmark it to save it for later.",Free,Open Source ( GPL-3.0 ),N/A,Norway,"Linux, Linux Mobile, Flathub, GNOME","English, Belarusian, Catalan; Valencian, Czech, German, Spanish, Basque, Finnish, French, Hebrew, Hindi, Hungarian, Italian, Japanese, Norwegian Bokmål, Dutch, Portuguese, Russian, Swedish, Turkish, Ukrainian, Chinese, ▾"
ReFra gallery,ReFra is an open source Android Gallery app built with Material 3 and Jetpack Compose. Mobileapp discovery,Free,Open Source ( Apache-2.0 ),"Photo Manager, Image Viewer","Romania, EU","Android, F-Droid","English, German, Chinese, Czech, French, Indonesian, Italian, Lithuanian, Japanese, Polish, Russian, Portuguese, Turkish, Ukrainian"
Vibe You,Vibe You (formerly MellowMusic) is a music app that lets you play music from your device storage and Piped Music.,Free,Open Source ( GPL-3.0 ),Audio Player,"Finland, EU","Android, F-Droid",English
Puzzmo,"Puzzmo is a platform dedicated to puzzles, offering a mix of traditional crossword puzzles, modern classics like Typeshift, and original puzzles, with access granted to a limited number of users daily.",Free,Proprietary,Puzzle Game,United States,Online,English
Xiaomi HyperOS,"Xiaomi HyperOS is a proprietary operating system developed by Xiaomi. It's designed to provide an enhanced user experience through its unique features and functionalities. The system integrates seamlessly with Xiaomi's wide range of devices, creating a unified and...",Free,Proprietary,"Mobile OS, Operating System",China,Android,English
Kyugo,Kyugo is a time-assistant software that integrates with your Google Calendar to automate event planning and promote work-life balance. Software,Freemium,Proprietary,Habit Tracker,N/A,"iPhone, iPad, Android",English
Steddy,"Steddy is a beautiful exercise planner with no extra frills. Create a plan for your next week within minutes, log any activity in a single tap, and track your complete activity history with beautiful charts and trends.",Freemium,Proprietary,N/A,United States,"iPhone, iPad",English
Tidby,"Tidby is an AI-enhanced news reader app that provides personalized, bite-sized news summaries, and offers features such as article engagement, a personal news library, and user-controlled news focus. Applicationsoftware reviews",Freemium (Subscription),Proprietary,"RSS Reader, News Reader",United States,"iPhone, iPad",English
ArtistAssistApp,"ArtistAssistApp is a web app for artists to accurately mix any color from a photo, analyze tonal values, turn a photo into an outline, draw with the grid method, paint with a limited palette, simplify a photo, compare photos pairwise, and more.",Freemium (Subscription),Open Source ( AGPL-3.0 ),"Digital Painting Tool, Color Picker Tool",N/A,Online  ,English
Polyfire,Polyfire's goal is to make it possible to code every AI tool/Chatbot you could want in only a couple of lines of code in the frontend without the need for complex abstractions and having to deploy anything.,Free,Open Source,N/A,United States,"Self-Hosted, npm",English
OpenAPI Devtools,Effortlessly discover API behaviour with a Chrome extension that automatically generates OpenAPI specifications in real time for any app or website. Software,Free,Open Source ( MIT ),N/A,N/A,Google Chrome,English
Remagine AI,Remagine AI is a content writer tool equipped with hundreds of templates and tools to generate best quality marketing content within seconds.,Freemium (Subscription),Proprietary,"AI Writing Tool, AI Chatbot",N/A,Online,English
Roadmap Game,"Roadmap Game is a software application designed to assist individuals in managing and overcoming social anxiety. The software operates on a gamified system, where users can accumulate miles by performing actions that require courage.",Free,Proprietary,N/A,N/A,iPhone,English
Family - Crypto Wallet,"Family is a self-custodial iOS app for managing Ethereum, enabling interaction with crypto assets, sharing wallet addresses via QR codes, trading tokens with a decentralized swap function, and accessing decentralized apps through WalletConnect.",Free,Proprietary,Crypto Wallet,N/A,iPhone  ,English
Cacophony,"Cacophony is a minimalist and ergonomic MIDI sequencer. It's minimalist in that it doesn't have a lot of functionality MIDI sequencers have. It's ergonomic in that there is no mouse input and a very clean interface, allowing you to juggle less inputs and avoid...",Free,Open Source ( MIT ),"Music Production App, Audio Editor",Canada,"Windows, Mac, Linux, itch.io",English
Notify,Versatile GTK4 client designed to seamlessly interface with the ntfy notification service.,Free,Open Source ( GPL-3.0 ),N/A,N/A,"Linux, Flathub",English
Outlook for Linux,Unofficial Microsoft Outlook client for Linux using Electron. It uses the Web App and wraps it as a standalone application using Electron. Linux& Unix,Free,Open Source ( GPL-3.0 ),N/A,N/A,"Linux, Flathub, Snapcraft",English
Writerside,The most powerful development environment – now adapted for writing documentation.,Free,Proprietary,Documentation Generator,"Czechia, EU",IntelliJ IDEA  ,English
Ghost Bookmarker,"Use Ghost Bookmarker to easily add links and notes to a post, straight from your browser. WebBrowsers",Free,Proprietary,N/A,United States,"Google Chrome, Ghost",English
Jogger,"Jogger is a mobile Linux-based application that allows users to monitor and record a variety of physical activities such as running, walking, cycling, swimming, and other workouts. It utilizes Geoclue location tracking to record workout sessions, providing detailed data on the... Software",Free,Open Source,"Run Tracker, Fitness Tracker",N/A,"Linux Mobile, GNOME, Flathub",English
Score Tracker,"Score Tracker is a software application designed to monitor and record player scores in various turn-based games including card and board games. This tool offers the capability to handle an unlimited number of players and turns, providing flexibility and adaptability for a wide... Software",Free,Open Source ( MIT ),N/A,N/A,"Linux, Flathub",English
LegalNow,"LegalNow is an AI-powered legal assistant that offers contract drafting, review, and management for small businesses in a cost-effective and user-friendly manner.",Free,Proprietary,N/A,N/A,Online,English
Universe,"Universe is a visual, no-code website builder that you can use from any device. Drag and drop blocks to construct your pages on your phone, tablet, or computer.",Freemium (Subscription),Proprietary,Website Builder,N/A,"Mac, Online, iPhone, iPad",English
LocalPilot,Use GitHub Copilot locally on your Macbook with one-click.,Free,Open Source ( MIT ),AI Coding Assistant,N/A,"Mac, Visual Studio Code",English
3D to Photo,"3D to Photo is an open-source package by Dabble, that combines Three.js and Stable Diffusion to build a virtual photo studio for product photography.",Free,Open Source ( MIT ),"AI Image Generator, AI Image Editor",N/A,Self-Hosted,English
autotab,Welcome to autotab! autotab makes it easy to create auditable browser automations using AI. Go from a point & click demonstration in the browser to live code for those actions in seconds. WebBrowsers,Free,Open Source ( MIT ),N/A,N/A,"Google Chrome, Linux, Mac, Windows",English
Scrupp,"Chrome extension for LinkedIn and Sales Navigator that extracts profile, company, and job details, finds and verifies emails, allows scraping up to 2500 profiles per session, enables advanced filtering, and enriches leads for efficient B2B outreach and marketing.",Subscription,Proprietary,N/A,United Kingdom,"Online, Google Chrome, Software as a Service (SaaS)",English
Hosting Checker,Find out who hosts any website and where it is hosted.,Free,Proprietary,N/A,N/A,"Online, Google Chrome, Mozilla Firefox",English
AntiiQ,AntiiQ is an offline Android music player with some opinionated features and a distinctive User Interface designed for both ease of navigation and customization.,Free,Open Source,Audio Player,N/A,"Android, F-Droid",English
Me Calendar,"Me Calendar is a user-friendly calendar app equipped with widget support. Seamlessly integrate with Google Calendar, Microsoft 365, Outlook.com, iCloud, CalDAV, and WebCAL. Software",Freemium (Pay once or Subscription),Proprietary,Calendar App,United Kingdom,Windows,"English, Korean, Chinese, Spanish, Portuguese, French, German, Vietnamese, Swedish, Norwegian, Russian, Turkish"
Taja AI,"AI-powered software streamlines YouTube content optimization with instant SEO-driven titles, descriptions, chapters, and tags, offers Live Preview for titles, and saves users an average of 43 minutes per upload, helping improve discoverability and channel growth.",Subscription,Proprietary,N/A,United States,Online,"English, Spanish, German, French, Italian, Hindi"
Roomy,"This tool is designed specifically for developers, ensuring that your workspace remains clean and efficient. From sweeping away outdated Xcode files to managing Docker containers and tidying up JavaScript dependencies, Roomy handles it all.",Free,Proprietary,System Cleaner,N/A,Mac,English
MarkFlowy,"Modern markdown editor application, Build fast and efficient workflows. Applicationsoftware reviews",Free,Open Source ( AGPL-3.0 ),Note-taking Tool,N/A,"Mac, Windows, Linux",English
Canta,"Canta is a software tool designed to facilitate the uninstallation of apps from your device, irrespective of whether root access is available or not. It provides a solution for removing any application, even those that might be deeply ingrained within the system. Newsoftware releases",Free,Open Source ( LGPL-3.0 ),"Software Uninstaller, System Cleaner","Slovenia, EU","Android, F-Droid",English
Obiklip,Obiklip simplifies video editing for speech and podcast content.,Pay once,Proprietary,"Audio Transcription Tool, Video Transcription Tool",N/A,"Mac, Windows","English, Afrikaans, Bosnian, Czech, Finnish, Hebrew, Italian, Latvian, Maori, Portuguese, Slovene, Tamil, Vietnamese, Arabic, Bulgarian, Danish, French, Hindi, Japanese, Lithuanian, Nepali, Romanian, Spanish, Thai, Welsh, Armenian, Catalan; Valencian, Dutch, Galician, Hungarian, Kannada, Macedonian, Norwegian, Russian, Swahili, Turkish, Azerbaijani, Chinese, German, Icelandic, Kazakh, Malay, Persian, Serbian, Swedish, Ukrainian, Belarusian, Croatian, Estonian, Greek, Indonesian, Korean, Marathi, Polish, Slovak, Tagalog, Urdu, ▾"
DeftGPT,DeftGPT is the advanced and upgraded version of ChatGPT providing you with instant access to information right on your browser.,Subscription,Proprietary,"AI Chatbot, AI Writing Tool",United States,"Software as a Service (SaaS), Online","English, French, German, Chinese, Portuguese, Czech, Malay, Korean, Japanese, Italian, Dutch"
Grayjay,"Multi-platform streaming client supporting YouTube, Twitch, Odysee, Rumble, PeerTube, Dailymotion, Patreon, Kick, and more, featuring a unified feed, playlist import, live chat, background play, offline downloads, local playlist management, and device casting.",Free,Proprietary,"YouTube Client, Video Streaming App",United States,"Mac, Windows  , Linux, Android, Android Tablet, Flathub, F-Droid, Flatpak","English, Arabic, German, Spanish, French, Japanese, Korean, Portuguese, Russian, Chinese"
PeerPanda,PeerPanda is a web-based tool tailored for Product Managers and Marketers seeking an efficient way to keep tabs on their competitors.,Freemium (Subscription),Proprietary,N/A,N/A,Online,English
Guidejar,"Transform documentation with AI-powered guides and demos. Enjoy seamless workflow capture via the browser, embed online, and customize with branding. Optimize guide visibility with SEO and enhance engagement using no-code features like click targets and CTAs. WebBrowsers",Freemium (Subscription),Proprietary,"Product Demo Builder, Screen Recorder",India,"Mac, Windows, Online, Google Chrome, Software as a Service (SaaS)",English
PrivacyPros,"PrivacyPros is a website that allows it's subscribers to have their information deleted from the web - stop scam calls, trolls, hackers, and the like.",Subscription,Proprietary,Privacy Tool,N/A,Online,English
Infographic Maker for iOS,Unleash your creativity and effectively communicate your ideas through stunning infographics. Download Infographic Maker now and start visualizing your concepts effortlessly.,Freemium (Subscription),Proprietary,N/A,N/A,"iPhone, iPad",English
Commitspark,Commitspark is a headless Content Management System (CMS) built entirely on GitHub.,Free,Proprietary ( ISC ),N/A,N/A,"Online  , Self-Hosted  ",English
Aptree Learning,"Aptree is a state-of-the-art Learning Management System (LMS) built with a focus on ease of use, versatility, and efficiency.",Free,Open Source ( GPL-3.0 ),"Online Education Service, Learning Management System",N/A,Online,English
Resources,"Resources is a simple yet powerful monitor for your system resources and processes, written in Rust and using GTK 4 and libadwaita for its GUI.",Free,Open Source ( GPL-3.0 ),"System Information Utility, Process Monitoring Tool",International,"Linux, Flathub, Linux Mobile",English
PokeTube,"Libre front-end for YouTube prioritizing privacy and anonymity, lacking cookies or tracking, with custom CSS, ambient mode, Return YouTube Dislike API, web search, games, account ID system, and high-quality audio plus YouTube video downloads and no data collection.",Free,Proprietary,"YouTube Downloader, YouTube Client",N/A,"Online, Self-Hosted",English
QR Code AI 2.0,"QR Code AI V2 is here! Next-gen AI allows you to create custom QR codes, including artistic designs. Enjoy smart link previews and advanced analytics. New features and improved AI based on user feedback for a better experience 💜",Freemium (Subscription),Proprietary,QR Code Generator,N/A,Online,"English, Spanish, French, Portuguese, Dutch, Italian, Chinese, Korean, Hindi, Arabic, Indonesian, Russian, Turkish"
Aptree Learning,"Aptree is a state-of-the-art Learning Management System (LMS) built with a focus on ease of use, versatility, and efficiency.",Free,Open Source ( GPL-3.0 ),"Online Education Service, Learning Management System",N/A,Online,English
Resources,"Resources is a simple yet powerful monitor for your system resources and processes, written in Rust and using GTK 4 and libadwaita for its GUI.",Free,Open Source ( GPL-3.0 ),"System Information Utility, Process Monitoring Tool",International,"Linux, Flathub, Linux Mobile",English
Turnip,"Turnip is a menubar timer app that allows you to easily track your time, either directly in-app or to third-party services like FreeAgent or FreshBooks. MobileApps & Add-Ons",Freemium (Subscription),Proprietary,Time Tracking Tool,N/A,Mac,English
MyMeet.io,"MyMeet.io simplifies scheduling, payments, and meeting handling for both professionals and clients, streamlining the entire process.",Subscription,Proprietary,Appointment Scheduler,N/A,Software as a Service (SaaS),English
Shorter.gg,"Shorter.gg is different from other short link services because it offers a complete platform that helps your brand grow and gets more clicks on your short links. It's not just a regular link shortener. It has lots of useful things, like:",Free,Proprietary,"URL Shortener, QR Code Generator",N/A,Online,English
JWIZARD Cleaner,"JWIZARD Cleaner"" optimizes the performance of your device effortlessly. Free up disk space by deleting unnecessary files, cache and Xcode data and improve performance. The intuitive interface makes cleaning and optimizing your system a simple matter. FreeVPN services",Subscription,Proprietary,System Cleaner,United States,Mac  ,"English, French, German, Italian, Portuguese, Russian, Spanish, Turkish"
Discodus,"Are you tired of your Discord server staying hidden in the shadows? 😞 Say hello to Discodus, your ultimate server booster!",Free,Proprietary,N/A,N/A,Online,English
ContentSwift,"ContentSwift - Free content research / optimization tool for SEO. As an alternative for Surfer, Neuronwriter, Frase, etc.. FreeVPN services",Free,Open Source,N/A,N/A,"Mac, Windows, Linux",English
YT Siphon,"YT Siphon is a browser extension that lets you choose to open YouTube videos in alternative frontends. Instead of auto-redirecting, it gives you the power to decide with simple shortcuts.",Free,Open Source ( MIT ),N/A,N/A,Firefox,English
swiftGuard,Anti-forensic macOS tray application designed to safeguard your system by monitoring USB ports. It ensures your device's security by automatically initiating either a system shutdown or hibernation if an unauthorized device connects or a connected device is unplugged. MacOS,Free,Open Source ( GPL-3.0 ),N/A,N/A,Mac,English
Sessionic,"A browser extension to save, manage and restore tabs and sessions. WebBrowsers",Free,Open Source ( AGPL-3.0 ),Tab Manager,Norway,"Microsoft Edge, Google Chrome",English
AiSpartanz.com,"Ai Spartanz.com is a revolutionary Generative AI platform designed to empower businesses and individuals to bring their imaginations to life. With the ability to supercharge a vast array of content, this platform has become an invaluable tool for scaling up marketing materials.",Subscription,Proprietary,N/A,N/A,Online,English
AppyHigh,AppyHigh Prime is the world's First Generative AI Apps bundle which helps the user in enhancing the creativity and supercharge the productivity. Applicationsoftware reviews,Subscription,Proprietary,N/A,India,Online,English
Klarity,Turn your messy voice notes into summarized text & save to notion.,Freemium (Subscription),Proprietary,N/A,N/A,"Online, Android, iPhone",English
Kali,"Manage your time better, faster, and smarter with Kali--your A.I. calendar assistant.",Freemium (Pay once),Proprietary,N/A,N/A,iPhone,English
DiceRight,"DiceRight is an online platform for playing tabletop games. It tracks game aspects like turns and damage to speed up gameplay and eliminate tedious elements. The platform offers extensive customization, including character classes, races, game currencies, and languages.",Free,Proprietary,Virtual Tabletop,N/A,Online,English
InfyniDock,"InfyniDock is a window-level Dock for macOS that lets you preview and jump to the exact app window — not just the app — with live previews, Option + Tab, FloatDock, and workspaces. MacOS",Pay once,Proprietary,"Application Launcher, Dock Utility",China,Mac,"English, Chinese"
"Deepen: AI Therapy, Counseling",The AI Therapy app - a space to explore and understand yourself. Applicationsoftware reviews,Subscription,Proprietary,N/A,United States,"Android, iPhone, iPad, Android Tablet",English
WordMe.ai,"WordMe, a comprehensive AI-driven platform for mastering digital marketing in today's competitive online space. In this digital age, having a strong online footprint is not optional—it's critical.",Freemium (Subscription),Proprietary,N/A,N/A,Online,English
Game Server Watcher,"Game Server Watcher, often abbreviated as GSWatcher, is a straightforward application designed to monitor the status of your preferred game servers and remotely manage your personal servers. It incorporates a buddy list feature and has the capability to alert you when a friend...",Free,Open Source ( AGPL-3.0 ),N/A,N/A,"Linux, Flathub",English
Kleaner,"Kleaner is an image metadata cleaner that can handle EXIF, IPTC, XMP and Comments. It is available under the GPL-3.0 license.",Free,Open Source ( GPL-3.0 ),N/A,N/A,"Linux, Flathub",English
FeedDeck,"FeedDeck is an open source RSS and social media feed reader, inspired by TweetDeck. FeedDeck allows you to follow your favorite feeds in one place on all platforms.",Subscription,Open Source ( MIT ),"RSS Reader, News Reader","Germany, EU","Mac, Windows, Linux, Online, Android, iPhone, Android Tablet, iPad, Flathub, Flatpak",English
Dosage,"Dosage is a software application designed to assist users in managing their treatments. It offers a range of features including notifications for timely reminders, a history log to track medications taken or missed, and dosage management for handling multiple doses at different...",Free,Open Source ( GPL-3.0 ),Pill Reminder,Brazil,"Linux, Flathub",English
CamX - USB Camera,"CamX - USB Camera is a multifunctional iOS app that converts your device into a portable video capture tool, capable of recording from various sources, and can also serve as a gaming console display or secondary screen. Applicationsoftware reviews",Free,Proprietary,Screen Mirroring App,United States,"iPad, iPhone","English, Arabic, Chinese, Danish, Dutch, French, German, Italian, Japanese, Korean, Polish, Portuguese, Russian, Spanish, Swedish"
PrintOnly,"PrintOnly is a Windows software tool that restricts documents (PDF, Image, Word, Excel, PowerPoint and more) to be printed only by physical USB printers and cannot be viewed or edited. Software",Free,Proprietary,N/A,N/A,Windows,"English, Arabic, Czech, Chinese, Dutch, French, German, Greek, Hungarian, Italian, Japanese, Korean, Polish, Portuguese, Russian, Spanish, Turkish"
Speech Meter,Practice English pronunciation with Speech Meter. An AI-powered tool that will analyze your accent and score your pronunciation accuracy.,Free,Proprietary,N/A,N/A,Online,English
Skylight Forecast,"Skylight Forecast is an app by the creators of Halide Camera and Spectre. It predicts evening light quality based on atmospheric conditions, aiding in planning outdoor activities like photography. Applicationsoftware reviews",Freemium,Proprietary,N/A,United States,iPhone,English
Shapo.io,"Shapo makes it super simple to collect, manage, and showcase your best testimonials, hassle-free. It is vital for businesses to display testimonials and elements that enhance customer trust and credibility. Shapo.io was born out of this insight to empower you.",Freemium (Subscription),Proprietary,N/A,N/A,Online,English
admin AI,"Admin AI is a tool that streamlines administrative tasks for Account Executives, Sales Development Representatives, and Sales Engineers. It efficiently updates your CRM system and drafts follow-up emails, reducing time spent on Salesforce updates and other tasks.",Subscription,Proprietary,N/A,United States,Google Chrome,English
Elgato Marketplace,"Marketplace makes it easy to express yourself online. Find all kinds of digital assets, all in one place, curated by Elgato.",Freemium (Pay once),Proprietary,N/A,"Germany, EU",Online,English
FliQR,"FliQR, the hassle-free tool that simplifies your file sharing and QR code generation needs. You can upload any file without any cost, and in an instant, receive a unique QR code ready for download and sharing.",Freemium (Subscription),Proprietary,QR Code Generator,N/A,Online,English
Circleback.ai,"Circleback automatically writes assigned action items and meeting notes after calls on Google Meet, Teams, and Zoom. The team has obsessed over the quality of the action items and notes, and they’ve built the leading product in the space.",Subscription,Proprietary,Note-taking Tool,United States,Online,"English, Chinese"
MoniCon,MoniCon let you use iPad as a portable console monitor!.,Free,Open Source,N/A,N/A,iPad,English
Recurring Expense Tracker,"Recurring Expense Tracker is a Material You recurring expense tracker, allowing you to keep track of your monthly spending. As its name suggests, it focuses on reccurring expenses such as rent, insurances, subscriptions etc.",Free,Open Source ( GPL-3.0 ),Personal Finance Tool,International,"Android, F-Droid","English, German, Chinese, French, Hindi, Russian, Spanish"
Linkwarden,"A fully self-hostable, open-source collaborative bookmark manager to collect, organize and archive webpages.",Freemium (Subscription),Open Source ( AGPL-3.0 ),"Bookmark Manager, Social Bookmarking Tool",Canada,"Online, Android, iPhone, Android Tablet, iPad, Self-Hosted, Google Chrome, Cloudron, Docker, Mozilla Firefox",English
Autu Mandu,Autu Mandu is an android application based on the discontinued Car Report with some new options that allows you to enter refueling and other income and expenses of your vehicles in addition to displaying nice reports. Applicationsoftware reviews,Free,Open Source ( Apache-2.0 ),N/A,N/A,"Android, F-Droid",English
Spacedrive,"Open-source file explorer integrates cloud, local, and offline storage across devices using a secure virtual distributed filesystem in Rust, enabling unified management, file syncing, privacy control, intuitive interface, and ownership without centralized servers. SoftwareUtilities",Free,Open Source,"File Manager, File Sync Tool",United States,"Mac, Windows, Linux",English
Otomate,"Otomate is a one-stop Product Information Management (PIM) tool. Store, manage, optimize and sync your product content with the top eCommerce channels.",Free,Proprietary,E-commerce System,N/A,"Online, Software as a Service (SaaS)",English
Genki Studio,"Genki Studio is a software that turns your iPad into a portable monitor and video capture device. It connects to a Genki ShadowCast or any USB UVC device, with features like external monitor support, Apple Pencil markup, and multitasking. Software",Free,Proprietary,N/A,United States,iPad,English
Twenty CRM,"Open-source CRM combining advanced features, sleek intuitive interface, secure user-controlled data management, team collaboration, user-driven customization, and freedom from vendor lock-in, suitable for small and medium-sized businesses seeking flexibility.",Freemium (Subscription),Open Source,CRM System,N/A,"Self-Hosted, Software as a Service (SaaS), Docker",English
Warehouse,"Warehouse is a versatile toolbox for managing flatpak user data, viewing flatpak app info, and batch managing installed flatpaks. Software",Free,Open Source ( GPL-3.0 ),"Package Manager, Software Installer",N/A,"Linux, Flathub, Flatpak, Linux Mobile",English
