title,description,cost,license,app_type,origin,platform,supported_languages
okke,"okke takes all the boring financial admin involved in running your own business and makes it easy. Perfect for freelancers, consultants, tradies and sole traders; okke makes money easy.",Freemium (Subscription),Proprietary,Invoicing Software,N/A,"Online, Software as a Service (SaaS)",English
Tibio,"Tibio is a comprehensive wellbeing app designed with a beautiful interface. It helps users track their moods and the sources of their feelings, and provides insights through data analysis. All the data is securely saved locally on the user's phone for privacy and safety. Software",Free,Proprietary,Journaling App,"Sweden, EU","Android, iPhone",English
Treblle,"Treblle is a federated API Intelligence platform delivering full API visibility, security, and control from one integration point.",Freemium (Subscription),Proprietary,N/A,"Croatia, EU","Mac, Windows, Online, Android, iPhone, Android Tablet, iPad, Software as a Service (SaaS)",English
Fortect,"Offers performance enhancement with Swift Clean and Core Stability, malware shielding across platforms, cloud security, chrome browsing protection, and real-time ransomware defense.",Subscription,Proprietary,Anti-Malware App,Israel,"Windows, Android, Android Tablet, Google Chrome",English
Mindko,"College Tools offers instant solutions on questions for various platforms like Blackboard and Moodle using AI. Handles images, graphs, ensures privacy, and supports multiple languages. With features like Auto-Select, Camouflage Modes, and more, it's universally compatible.",Subscription,Proprietary,Math Solver,"Luxembourg, EU","Mac, Windows, Linux, Google Chrome, iPhone",English
Good Tape,"A free, secure, and easy automatic transcription service, that delivers astounding transcriptions in minutes. Made in Denmark for journalists and anyone else. Freeware& Shareware",Freemium (Subscription),Proprietary,Audio Transcription Tool,N/A,Online,English
IconifyAI,Let AI design the perfect icon for your app in seconds. No more expensive time-consuming traditional app icon design. Trusted by 1400+ customers. MobileApps & Add-Ons,Pay once,Proprietary,Icon Creator,N/A,Online,English
littlecook,"Introducing littlecook - the ultimate solution to the age-old question, ""What should I eat now?"" Our app turns everyday ingredients into mouthwatering meals. Not only will your taste buds thank you, but the planet will too. MobileApps & Add-Ons",Free,Proprietary,N/A,N/A,"Online, iPhone, iPad",English
Matano,"Matano is an open source security lake platform for AWS. It lets you ingest petabytes of security and log data from various sources, store and query them in a data lake, and create Python detections as code for realtime alerting.",Free,Open Source ( Apache-2.0 ),N/A,N/A,"Linux, Self-Hosted",English
Tabs Lite,An ad-free open source guitar tablature application using an existing popular tabs database. Built for speed and simplicity. Software,Free,Open Source ( Apache-2.0 ),N/A,N/A,Android,English
PUSH.fm,"PUSH.fm is an all-in-one social marketing platform that gives musicians, content creators and brands powerful tools to promote their content & grow their social following. PUSH is completely free to use and easy to navigate, with all of our tools being customisable to suit... Opensource software",Free,Proprietary,N/A,United Kingdom,Online,English
RouteNote Create,"Search, listen, & download hundreds of thousands of royalty-free sounds. Access one-shots, loops, FX & full sample packs from top producers.",Subscription,Proprietary,"Music Discovery Service, Music Production App",United Kingdom,Online,English
TimeNinja,TimeNinja is a time collaboration software that runs on the web and allows users to easily share their time with team members and know each other's work status Software,Free Personal,Proprietary,N/A,N/A,Online,English
MediaCentral,"MediaCentral provides a unified media production platform—deployed on-premises or in the cloud—that enables collaboration from anywhere, accelerating content turnaround.",Pay once or Subscription,Proprietary,N/A,United States,"Mac, Windows, Online, Software as a Service (SaaS)","English, German"
ReachEngine,"ReachEngine is an email marketing platform where you can take care of all your email campaign requirements under one roof. Manage your lists, create beautiful email templates, send or schedule campaigns on the go, and watch your business grow with real-time statistics.",Freemium (Subscription),Proprietary,Email Marketing Service,N/A,Online,English
Overtune,"Making music should be easy, fun, and accessible to everyone. Overtune provides you with the tools to create your own viral songs without the need for any prior musical knowledge or experience. In just a few steps you can make beats, record your voice with voice effects and...",Free,Proprietary,Music Production App,N/A,"iPhone, iPad",English
Snapit,"Snapit is a tool to capture, annotate, and share screenshots with just few buttons. Take a screenshot of anything on your screen and we’ll make it look amazing in seconds. Creating beautiful screenshots has never been so easy!",Freemium (Subscription),Proprietary,Screenshot Capture Tool,N/A,Online,English
LiveKit,"LiveKit's APIs make it easy to build and scale live video and audio features such as interactive live streaming, video or audio calls, communications in games, and robotics teleoperation. LiveKit supports up to 100,000 simultaneous participants per session and includes...",Freemium (Subscription),Open Source ( Apache-2.0 ),N/A,United States,"Self-Hosted, Software as a Service (SaaS)",English
Gonarch,"Enable traffic split, load balancing and automatic failover for your MySQL clusters just changing the connection string. Gonarch is a serverless solution to implement MySQL high availability without the pain and cost of installation and maintenance.",Subscription,Proprietary,N/A,N/A,Online  ,English
Beesy: Record Google Meets,"Record Google Meets for free, no signups, download locally. Opensource software",Free Personal,Proprietary,Web Conferencing Tool,N/A,Google Chrome,English
Tribeloo,"Tribeloo is the easy-to-use desk booking solution to collaborate in the hybrid workplace. Change management is hard. Therefore, Tribeloo makes it easy to bring employees back together and optimize your hybrid workplace.?",Subscription,Proprietary,N/A,N/A,"Mac, Windows, Online, Android, iPhone, Software as a Service (SaaS)","English, French, Spanish"
Shoutout.io,"Shoutout makes it easy to collect testimonials from social networks and directly from customers, organise them, then publish them to your website. Make the most of the social proof!",Freemium (Subscription),Proprietary,N/A,N/A,Online,English
KodeKloud,"Explore immersive cloud training with Docker, Kubernetes, and more, gaining certificates with practical labs and community access. Offers multiple membership plans including Business with advanced team support.",Subscription,Proprietary,N/A,India,Online,English
ImagineMe,"Upload 10–20 personal images to train a private AI model that quickly generates digital art or portraits based on your likeness using text prompts, with initial training under five hours and subsequent image creation completed in seconds for privacy and personalization.",Pay once,Proprietary,AI Image Generator,"Netherlands, EU",Online,English
Univerbal,"Meet Univerbal (formerly Quazel, but now you can actually spell it!), your AI tutor and conversation partner for honing your language skills. Talk in real-life scenarios, ask grammar and vocabulary questions, and receive speaking feedback.",Pay once or Subscription,Proprietary,Language Learning Tool,N/A,"iPhone, iPad, Android, Android Tablet, Online",English
LumoTray,"LumoTray is a lightweight Windows tray app for multi-monitor wallpapers, lock screen images, screensaver modes, hot corners, and custom tray menus.",Free Personal,Proprietary,N/A,N/A,Windows,English
Mainchan,"Mainchan is a content aggregation, web content rating, and discussion website. Registered members submit content to the site such as links, text posts, images, videos, and polls, which are then voted up or down by other members.",Free,Proprietary,"Social Network, Social News",N/A,Online,English
Bilibili,"Bilibili is an ad-free video-sharing website and this website allows users to upload, view and share their own videos for free, also they provide licenced anime and donghua titles through their website. VideoSharing",Freemium (Subscription),Proprietary,"Video Streaming App, Video Sharing Tool",China,"Online, Android  , iPhone  , Android TV","English, Indonesian, Thai, Malay, Vietnamese"
TapTab,Built with power users in mind. You will love it if you are a collector of tabs. It was time Safari got a web extension that lets you move around tabs similar to how one does when using Chrome or Firefox. With a sprinkle of features to save you time.,Free,Proprietary,N/A,N/A,Mac,English
OtoZen,"OtoZen is a driving safety and location-sharing app for new and experienced drivers with real-time speeding and texting alerts, live location sharing with ETA, automatic crash detection and emergency response. Applicationsoftware reviews",Freemium (Subscription),Proprietary,Social Network,United States,"Android, iPhone",English
LocalSend,"Open-source solution providing encrypted, peer-to-peer file and message sharing across Windows, macOS, Linux, Android, and iOS without internet access, using only local networks. No setup required, ensuring privacy with no cloud involvement or external servers. OpenSource",Free,Open Source ( Apache-2.0 ),Large File Transfer Service,"Germany, EU","Mac, Windows, Linux, Online  , Android, iPhone, Android Tablet, iPad, AppImageHub, Snapcraft, Flathub, F-Droid, Chocolatey, Linux Mobile","English, French"
Activepieces,"Activepieces is an open source no-code AI automation tool. The only AI automation tool loved by both technical and non-technical users. It's super extensible code-wise and super easy UI-wise. With Activepieces, you can automate your departments (marketing, sales, HR, legal...",Freemium (Pay once),Open Source,"Workflow Automation Tool, Task Automation App",United States,"Mac, Windows, Linux, Software as a Service (SaaS), Docker","English, French, Russian, Indonesian, German, Spanish, Italian, Chinese, Portuguese, Vietnamese, Ukrainian, Hungarian, Dutch"
blendOS,A seamless blend of all Linux distributions. Linux& Unix,Free,Open Source ( GPL-3.0 ),"Linux Distro, Operating System",India,Linux,English
Slint,"GUI toolkit for Rust, C++, and JavaScript to efficiently develop fluid graphical user interfaces for embedded devices and desktop applications. Applicationsoftware reviews",Free,Open Source,Software Framework,"Germany, EU","Mac, Windows, Linux, Online",English
Auxio,"Auxio is a local music player with a fast, reliable UI/UX without the many useless features present in other music players. Built off of Exoplayer, Auxio has superior library support and listening quality compared to other apps that use outdated android functionality. Mobileapp discovery",Free,Open Source ( GPL-3.0 ),Audio Player,United States,"Android, F-Droid",English
Simple Time Tracker,"Simple Time Tracker helps you track how much time you spend during the day on different activities. Start new activities with one click. View previous records and statistics over time. The app is free and open source. Also, widgets, backups, notifications and dark mode. Applicationsoftware reviews",Free,Open Source ( GPL-3.0 ),Time Tracking Tool,N/A,"Android, F-Droid",English
Karbonized,Make awesome images of your code or your screenshots.,Free,Open Source ( Apache-2.0 ),N/A,International,"Mac, Windows, Linux, Online, Android",English
Pocket IP,"Easy and affordable trademark portfolio management – docket, search, monitor, and request actions with the trademarks in one place.",Free,Proprietary,N/A,N/A,Online,English
KeyFX,KeyFX is a screencast and presentation utility that allows you to highlight the mouse cursor and visualize your keystrokes.,Pay once,Proprietary,"Screen Casting Tool, Keystroke Visualizer","Romania, EU",Windows,English
Cubo,"Cubo is an advanced online office solution that makes it easy to connect your prospects, clients and teams and expand your network just with your unique link.",Free,Proprietary,N/A,Brazil,Online,English
daditosapp,"Daditos is a web application designed to roll virtual dies in a private multiplayer roomm. Available dice are from D3 to D100, Fudge, card deck and coin flip. With a superb UI, light and dark mode, sounds and more!. Applicationsoftware reviews",Free,Proprietary,N/A,N/A,Online,"English, Spanish"
GPTKit,"GPTKit is an advanced AI text generation detection tool, designed to help users distinguish between human-written and machine-generated text. With GPTKit, you can easily detect the generated text by using our state-of-the-art technology which is highly accurate in identifying...",Freemium (Pay once),Proprietary,N/A,India,Online,English
Directory of Open Access Books,"DOAB is a community-driven discovery service that indexes and provides access to scholarly, peer-reviewed open access books and helps users to find trusted open access book publishers. All DOAB services are free of charge and all data is freely available. Opensource software",Free,Proprietary,Ebook Library,"Netherlands, EU",Online,"English, French"
Flush - Toilet Finder & Map,"Flush Toilet Finder is the quickest, simplest way of finding a public bathroom or restroom. Simply open the app and it will display the nearest toilets to you. It's free, no in-app purchases and has over 200,000 bathrooms in its database! Software",Free,Proprietary,"Toilet Finder, Map Service","Netherlands, EU","Android, iPhone, iPad, Android Tablet",English
Directory of Open Access Journals,"DOAJ is a unique and extensive index of diverse open access journals from around the world, driven by a growing community, committed to ensuring quality content is freely available online for everyone.",Free,Proprietary,Ebook Library,United Kingdom,Online,English
Space: Spaced Repetition,Space is an easy-to-use Spaced Repetition System (SRS) app. Create and learn flashcards wherever you are in the most effective way possible. Mobileapp discovery,Free,Proprietary ( GPL-3.0 ),N/A,N/A,"Mac, Windows, Linux, Android, iPhone, Android Tablet, iPad, Flathub, Flatpak","English, German, Russian, Polish, French, Italian, Portuguese, Chinese, Spanish, Swedish"
Destiny,"Destiny is an end-to-end encrypted file transfer app. It allows people to securely send files without needing to reveal their identity to each other, or the service provider. No sign-up is needed.",Free,Open Source ( MIT ),N/A,"Germany, EU","Android, iPhone, Android Tablet, iPad, F-Droid, Windows, Mac, Linux",English
Damask,Damask is an automatic wallpaper application. It currently supports setting the wallpaper image from the following sources: Applicationsoftware reviews,Free,Open Source ( GPL-3.0 ),Wallpapers Hub,N/A,"Linux, Flathub, Flatpak, GNOME",English
defguard,defguard is an SSO & VPN Server based on OpenID and WireGuard VPN with unique secure & private architecture for building secure and privacy-aware organizations.,Freemium (Subscription),Proprietary,N/A,"Poland, EU","Self-Hosted, Mac, Linux, Windows, Docker, Kubernetes",English
Ai Chat everywhere,"Make AI Chat accessible everywhere on all websites. Support OpenAI ChatGPT, Google Bard, You Chat, Perplexity Ai, Bing image, Suno music, Copilot.",Free,Open Source,AI Chatbot,N/A,Firefox,English
Vinegar for Roblox,"An open-source, minimal, configurable, fast bootstrapper for running Roblox on Linux.",Free,Open Source ( GPL-3.0 ),N/A,N/A,"Linux, Flathub",English
Kimi,"AI assistant supports complex math, coding, image understanding, and reasoning with up to 128k token processing, short and long chain-of-thought tasks, visual and text input, accurate benchmarks, self-learning ability, and reinforcement learning for improvement.",Freemium (Subscription),Proprietary,"AI Chatbot, Large Language Model (LLM) Tool",China,"Online, Android, iPhone, iPad, Android Tablet, Google Chrome","English, Chinese"
Worktrek,"The WorkTrek App is for field workers to get work done faster and better with access to all necessary work order information. Scan an asset barcode to get asset details, take picture of asset state and/or completed work while you’re on location and attach it to the work order. MobileApps & Add-Ons",Subscription,Proprietary,N/A,"Croatia, EU","Online, Android, iPhone, iPad",English
yawb.io,"yawb.io, Yet Another Website Builder, is a free website builder built from the ground up to allow maximum flexibility and customizability. Freesoftware listings",Free,Proprietary,"Website Builder, CMS Tool",N/A,"Online, Self-Hosted, Software as a Service (SaaS)",English
Recs: For Favorite Places,"With Recs you can save, organize, and share the places that matter most. Follow friends to see their favorite spots, share yours, and go to the places you wanna go, together.",Free,Proprietary,N/A,N/A,iPhone,English
BlueWillow,Bring your ideas to life with AI-generated images.,Pay once,Proprietary,AI Image Generator,United States,"Online, Discord",English
Coherence,"Coherence automates DevOps and Platform Engineering for teams that are focused on finding and refining PMF. With Coherence teams can code faster, test sooner, and deploy more frequently.",Free Personal,Proprietary,Cloud Hosting Service,"Finland, EU","Online, Software as a Service (SaaS)",English
Convertri,"Build the best funnels you've ever built, with the easiest page builder you've ever used, and support that’s there when you need it.",Subscription,Proprietary,Website Builder,N/A,Online  ,English
Couple Joy: Journal & Memories,Couple Joy is a private space between you and your partner.,Freemium (Pay once),Proprietary,N/A,N/A,"iPhone, iPad","English, French, German"
Habinator,"Habinator is an all-in-one online coaching platform for professional health coaches to create, manage, track & measure their client's lifestyle change programs.",Paid,Proprietary,N/A,N/A,"Online, Android, iPhone","English, Finnish, German"
INLYSE Malware.AI,INLYSE Malware.AI is a cutting-edge AI-based IT security platform which identifies malware and cyber-attacks within seconds.,Freemium (Subscription),Proprietary,Anti-Malware App,"Germany, EU","Mac, Windows, Linux, Online, Google Chrome, Software as a Service (SaaS), Firefox","English, German, French, Portuguese"
NotiNotes,"A simple notes app, which only lives in your QS and notification panel. Quickly add, view and edit your notes and show them as notifications. All you need to do is adding the tile in your Quick Settings panel and you're ready to note. MobileApps & Add-Ons",Free,Open Source ( MIT ),N/A,N/A,"Android, F-Droid",English
Raytha,"Raytha is a powerful CMS for .NET developers with an easy-to-use interface and fast performance. It offers custom content types, a template engine, and various access controls.",Free,Open Source ( MIT ),CMS Tool,N/A,"Online, Self-Hosted, Software as a Service (SaaS)",English
Technical City,"With Technical City you can learn how well a PC game would run on your PC. In addition, we have thousands of CPUs and graphics card compared.",Free,Proprietary,N/A,N/A,Online,"English, Arabic, Chinese, French, German, Hindi, Indonesian, Japanese, Korean, Polish, Portuguese, Russian, Spanish, Turkish, Italian"
Todopad,This is a FOSS todo app with local backup and restore functionality made with flutter. Applicationsoftware reviews,Free,Open Source ( MIT ),N/A,N/A,"Android  , F-Droid  ",English
WeRelate,"WeRelate.org is a free public-service wiki for genealogy sponsored by the Foundation for On-Line Genealogy, Inc. formerly in partnership with the Allen County Public Library. The Foundation for On-Line Genealogy is a 501c3 charitable organization supported by tax-deductible... Freeware& Shareware",Free,Open Source ( GPL-2.0 ),Genealogy Tool,United States,Online,English
Who Said That?,"Introducing Who Said That?, the ultimate party game for all ages! Whether you're playing in person or remotely, this game will have you and your friends laughing and guessing all night long.",Free,Proprietary,N/A,N/A,"Android, iPhone",English
Wrk Automation Platform,"Automate your processes in minutes with the Wrk Platform. Drag-n-drop blocks that represent a single step in your process, powered by technology like APIs, bots, and actual skilled humans who can complete real work on your behalf. All this in one platform with zero code.",Freemium (Subscription),Proprietary,Workflow Automation Tool,United States,"Online, Chrome OS, Google Chrome, Software as a Service (SaaS), Firefox",English
MANGA Plus,"""MANGA Plus by SHUEISHA"" is the official manga reader from Shueisha Inc., and is available globally.",Free,Proprietary,Comic and Manga Reader,United States,"Android, iPhone, Android Tablet, iPad","English, Spanish, Portuguese, French, Thai, Russian, Indonesian"
Damus,"A Twitter-like Nostr client for iPhone, iPad and macOS.",Free,Open Source ( GPL-3.0 ),Social Network,United States,"Mac  , iPhone  , iPad  ",English
Ivory for Mastodon,"Ivory is a brand new app that brings over a dozen years of experience building the award-winning Tweetbot for Twitter, over to the Mastodon network. We obsess over every detail and put good design and experience first. Download and experience it for yourself. Mobileapp discovery",Freemium (Subscription),Proprietary,Mastodon Client,United States,"Mac, iPhone, iPad",English
boum,"Modern music player for Jellyfin servers with album downloads, offline mode, configurable storage, cross-navigation between albums and artists, artist and album recommendations, library rescanning, and streaming limits for WiFi or mobile, offering a streamlined interface.",Free,Open Source ( MPL-2.0 ),"Audio Player, Music Streaming Service",N/A,"F-Droid  , Jellyfin",English
Railway,"Provision and manage infrastructure, develop locally, deploy to the cloud, dynamically scale servers, storage, and networking, automate service discovery, integrate with GitHub and Docker, apply configurable observability, and safely manage environments for full-stack applications.",Subscription,Proprietary,"Cloud Hosting Service, Web Hosting Service",United States,"Online, Software as a Service (SaaS)",English
Hi-Fi Rush,"Feel the beat as wannabe rockstar Chai and his ragtag team fight against an evil megacorp with raucous rhythm combat! From Tango Gameworks comes Hi-Fi RUSH, an all-new action game where the world syncs to the music.",Pay once,Proprietary,Music Game,Japan,"Windows, Steam, Xbox, Playstation",English
Screen Studio,"Record macOS screens with smoothed mouse movement, zoomed click highlights, cinematic motion blur, and customizable backgrounds while integrating webcam, microphone, system sound, and easy video editing. Output in HD for instructional and promotional videos. MacOS",Subscription,Proprietary,"Screen Recorder, Screenshot Capture Tool","Poland, EU",Mac,English
MyInsta,"MyInsta is an InstaMod that allows users to have exclusive features such as downloading Reels, Videos, Photos, and No Ads.",Free,Proprietary,N/A,N/A,"Android, Android Tablet",English
EXADS,"EXADS is a powerful white label ad server that is used and trusted by ad networks, publishers and advertisers. The ad serving platforms built by EXADS can be customised to your requirements.",Pay once or Subscription,Proprietary,N/A,"Ireland, EU","Online, Software as a Service (SaaS)",English
memories365: My Photo Journal,"Memories365 is a photo journal app that organizes photos daily for tourists, adventure seekers, and moms-to-be, so they can recall their special moments. Mobileapp discovery",Free,Proprietary,N/A,N/A,"Android, iPhone, Android Tablet, iPad",English
Moodistory,"Moodistory is a low-effort mood tracker & habit tracker with a unique and beautiful design that highly respects your privacy. Create journal entries in less than 5 seconds, without writing a single word.",Free,Proprietary,N/A,"Austria, EU","Android, iPhone, iPad","English, Chinese, French, German, Japanese, Korean, Russian, Spanish"
NFS Technology,"NFS Technology is a respected international provider of market-leading digital technology and services for the workspace, hospitality, and venues industries.",Pay once or Subscription,Proprietary,N/A,N/A,Windows,English
Onefetch,Onefetch is a command-line Git information tool written in Rust that displays project information and code statistics for a local Git repository directly to your terminal. The tool is completely offline - no network access is required.,Free,Open Source ( MIT ),N/A,International,"Mac, Windows, Linux, BSD",English
Panaya Test Dynamix,"With Test Dynamix, you can quickly manage ERP tests with automatic workflows, easy documentation, real-time analytics, and smart change analysis.",Pay once,Proprietary,N/A,N/A,Online,English
PDF Doc Scan,"Main point of this app is to scan or select existing PDF documents simply using intent or chooser. Other apps require payment to access their api/sdk or simply don't have a possible way to do it. So they rely on switching between an app ,file chooser and a scanner. Mobileapp discovery",Free,Open Source ( BSD-3-Clause ),"Document Scanner, Image Scanner",N/A,"Android, F-Droid",English
Tiimo,"Tiimo is a visual daily planning app that helps you organize your life, stick to your routines, and work towards your personal goals. Applicationsoftware reviews",Freemium (Subscription),Proprietary,N/A,"Denmark, EU","Online, iPhone, iPad","English, Danish, French, German, Icelandic, Italian, Japanese, Norwegian Bokmål, Portuguese, Spanish, Swedish"
TinyWow,"TinyWow provides free online conversion, pdf, and other handy tools to help you solve problems of all types. Opensource software",Free,Proprietary,"Image Converter, Video Converter",United States,Online,English
